No.     Time           Source                Destination           Protocol Length Info
      1 0.000000000    10.0.5.11             10.0.5.22             TCP      74     56753 > krb524 [SYN] Seq=0 Win=29200 Len=0 MSS=1460 SACK_PERM=1 TSval=2366694 TSecr=0 WS=128

Frame 1: 74 bytes on wire (592 bits), 74 bytes captured (592 bits) on interface 0
    Interface id: 0
    Encapsulation type: Ethernet (1)
    Arrival Time: Mar 15, 2016 09:45:35.683876000 CET
    [Time shift for this packet: 0.000000000 seconds]
    Epoch Time: 1458031535.683876000 seconds
    [Time delta from previous captured frame: 0.000000000 seconds]
    [Time delta from previous displayed frame: 0.000000000 seconds]
    [Time since reference or first frame: 0.000000000 seconds]
    Frame Number: 1
    Frame Length: 74 bytes (592 bits)
    Capture Length: 74 bytes (592 bits)
    [Frame is marked: False]
    [Frame is ignored: False]
    [Protocols in frame: eth:ip:tcp]
    [Coloring Rule Name: TCP SYN/FIN]
    [Coloring Rule String: tcp.flags & 0x02 || tcp.flags.fin == 1]
Ethernet II, Src: IntelCor_1a:80:15 (68:05:ca:1a:80:15), Dst: IntelCor_1a:7c:75 (68:05:ca:1a:7c:75)
    Destination: IntelCor_1a:7c:75 (68:05:ca:1a:7c:75)
        Address: IntelCor_1a:7c:75 (68:05:ca:1a:7c:75)
        .... ..0. .... .... .... .... = LG bit: Globally unique address (factory default)
        .... ...0 .... .... .... .... = IG bit: Individual address (unicast)
    Source: IntelCor_1a:80:15 (68:05:ca:1a:80:15)
        Address: IntelCor_1a:80:15 (68:05:ca:1a:80:15)
        .... ..0. .... .... .... .... = LG bit: Globally unique address (factory default)
        .... ...0 .... .... .... .... = IG bit: Individual address (unicast)
    Type: IP (0x0800)
Internet Protocol Version 4, Src: 10.0.5.11 (10.0.5.11), Dst: 10.0.5.22 (10.0.5.22)
    Version: 4
    Header length: 20 bytes
    Differentiated Services Field: 0x00 (DSCP 0x00: Default; ECN: 0x00: Not-ECT (Not ECN-Capable Transport))
        0000 00.. = Differentiated Services Codepoint: Default (0x00)
        .... ..00 = Explicit Congestion Notification: Not-ECT (Not ECN-Capable Transport) (0x00)
    Total Length: 60
    Identification: 0x1047 (4167)
    Flags: 0x02 (Don't Fragment)
        0... .... = Reserved bit: Not set
        .1.. .... = Don't fragment: Set
        ..0. .... = More fragments: Not set
    Fragment offset: 0
    Time to live: 64
    Protocol: TCP (6)
    Header checksum: 0x0c55 [validation disabled]
        [Good: False]
        [Bad: False]
    Source: 10.0.5.11 (10.0.5.11)
    Destination: 10.0.5.22 (10.0.5.22)
    [Source GeoIP: Unknown]
    [Destination GeoIP: Unknown]
Transmission Control Protocol, Src Port: 56753 (56753), Dst Port: krb524 (4444), Seq: 0, Len: 0
    Source port: 56753 (56753)
    Destination port: krb524 (4444)
    [Stream index: 0]
    Sequence number: 0    (relative sequence number)
    Header length: 40 bytes
    Flags: 0x002 (SYN)
        000. .... .... = Reserved: Not set
        ...0 .... .... = Nonce: Not set
        .... 0... .... = Congestion Window Reduced (CWR): Not set
        .... .0.. .... = ECN-Echo: Not set
        .... ..0. .... = Urgent: Not set
        .... ...0 .... = Acknowledgment: Not set
        .... .... 0... = Push: Not set
        .... .... .0.. = Reset: Not set
        .... .... ..1. = Syn: Set
            [Expert Info (Chat/Sequence): Connection establish request (SYN): server port krb524]
                [Message: Connection establish request (SYN): server port krb524]
                [Severity level: Chat]
                [Group: Sequence]
        .... .... ...0 = Fin: Not set
    Window size value: 29200
    [Calculated window size: 29200]
    Checksum: 0x1e4f [validation disabled]
        [Good Checksum: False]
        [Bad Checksum: False]
    Options: (20 bytes), Maximum segment size, SACK permitted, Timestamps, No-Operation (NOP), Window scale
        Maximum segment size: 1460 bytes
            Kind: MSS size (2)
            Length: 4
            MSS Value: 1460
        TCP SACK Permitted Option: True
            Kind: SACK Permission (4)
            Length: 2
        Timestamps: TSval 2366694, TSecr 0
            Kind: Timestamp (8)
            Length: 10
            Timestamp value: 2366694
            Timestamp echo reply: 0
        No-Operation (NOP)
            Type: 1
                0... .... = Copy on fragmentation: No
                .00. .... = Class: Control (0)
                ...0 0001 = Number: No-Operation (NOP) (1)
        Window scale: 7 (multiply by 128)
            Kind: Window Scale (3)
            Length: 3
            Shift count: 7
            [Multiplier: 128]

No.     Time           Source                Destination           Protocol Length Info
      2 0.000615000    10.0.5.22             10.0.5.11             TCP      74     krb524 > 56753 [SYN, ACK] Seq=0 Ack=1 Win=28960 Len=0 MSS=1460 SACK_PERM=1 TSval=2365571 TSecr=2366694 WS=128

Frame 2: 74 bytes on wire (592 bits), 74 bytes captured (592 bits) on interface 0
    Interface id: 0
    Encapsulation type: Ethernet (1)
    Arrival Time: Mar 15, 2016 09:45:35.684491000 CET
    [Time shift for this packet: 0.000000000 seconds]
    Epoch Time: 1458031535.684491000 seconds
    [Time delta from previous captured frame: 0.000615000 seconds]
    [Time delta from previous displayed frame: 0.000615000 seconds]
    [Time since reference or first frame: 0.000615000 seconds]
    Frame Number: 2
    Frame Length: 74 bytes (592 bits)
    Capture Length: 74 bytes (592 bits)
    [Frame is marked: False]
    [Frame is ignored: False]
    [Protocols in frame: eth:ip:tcp]
    [Coloring Rule Name: TCP SYN/FIN]
    [Coloring Rule String: tcp.flags & 0x02 || tcp.flags.fin == 1]
Ethernet II, Src: IntelCor_1a:7c:75 (68:05:ca:1a:7c:75), Dst: IntelCor_1a:80:15 (68:05:ca:1a:80:15)
    Destination: IntelCor_1a:80:15 (68:05:ca:1a:80:15)
        Address: IntelCor_1a:80:15 (68:05:ca:1a:80:15)
        .... ..0. .... .... .... .... = LG bit: Globally unique address (factory default)
        .... ...0 .... .... .... .... = IG bit: Individual address (unicast)
    Source: IntelCor_1a:7c:75 (68:05:ca:1a:7c:75)
        Address: IntelCor_1a:7c:75 (68:05:ca:1a:7c:75)
        .... ..0. .... .... .... .... = LG bit: Globally unique address (factory default)
        .... ...0 .... .... .... .... = IG bit: Individual address (unicast)
    Type: IP (0x0800)
Internet Protocol Version 4, Src: 10.0.5.22 (10.0.5.22), Dst: 10.0.5.11 (10.0.5.11)
    Version: 4
    Header length: 20 bytes
    Differentiated Services Field: 0x00 (DSCP 0x00: Default; ECN: 0x00: Not-ECT (Not ECN-Capable Transport))
        0000 00.. = Differentiated Services Codepoint: Default (0x00)
        .... ..00 = Explicit Congestion Notification: Not-ECT (Not ECN-Capable Transport) (0x00)
    Total Length: 60
    Identification: 0x0000 (0)
    Flags: 0x02 (Don't Fragment)
        0... .... = Reserved bit: Not set
        .1.. .... = Don't fragment: Set
        ..0. .... = More fragments: Not set
    Fragment offset: 0
    Time to live: 64
    Protocol: TCP (6)
    Header checksum: 0x1c9c [validation disabled]
        [Good: False]
        [Bad: False]
    Source: 10.0.5.22 (10.0.5.22)
    Destination: 10.0.5.11 (10.0.5.11)
    [Source GeoIP: Unknown]
    [Destination GeoIP: Unknown]
Transmission Control Protocol, Src Port: krb524 (4444), Dst Port: 56753 (56753), Seq: 0, Ack: 1, Len: 0
    Source port: krb524 (4444)
    Destination port: 56753 (56753)
    [Stream index: 0]
    Sequence number: 0    (relative sequence number)
    Acknowledgment number: 1    (relative ack number)
    Header length: 40 bytes
    Flags: 0x012 (SYN, ACK)
        000. .... .... = Reserved: Not set
        ...0 .... .... = Nonce: Not set
        .... 0... .... = Congestion Window Reduced (CWR): Not set
        .... .0.. .... = ECN-Echo: Not set
        .... ..0. .... = Urgent: Not set
        .... ...1 .... = Acknowledgment: Set
        .... .... 0... = Push: Not set
        .... .... .0.. = Reset: Not set
        .... .... ..1. = Syn: Set
            [Expert Info (Chat/Sequence): Connection establish acknowledge (SYN+ACK): server port krb524]
                [Message: Connection establish acknowledge (SYN+ACK): server port krb524]
                [Severity level: Chat]
                [Group: Sequence]
        .... .... ...0 = Fin: Not set
    Window size value: 28960
    [Calculated window size: 28960]
    Checksum: 0x6897 [validation disabled]
        [Good Checksum: False]
        [Bad Checksum: False]
    Options: (20 bytes), Maximum segment size, SACK permitted, Timestamps, No-Operation (NOP), Window scale
        Maximum segment size: 1460 bytes
            Kind: MSS size (2)
            Length: 4
            MSS Value: 1460
        TCP SACK Permitted Option: True
            Kind: SACK Permission (4)
            Length: 2
        Timestamps: TSval 2365571, TSecr 2366694
            Kind: Timestamp (8)
            Length: 10
            Timestamp value: 2365571
            Timestamp echo reply: 2366694
        No-Operation (NOP)
            Type: 1
                0... .... = Copy on fragmentation: No
                .00. .... = Class: Control (0)
                ...0 0001 = Number: No-Operation (NOP) (1)
        Window scale: 7 (multiply by 128)
            Kind: Window Scale (3)
            Length: 3
            Shift count: 7
            [Multiplier: 128]
    [SEQ/ACK analysis]
        [This is an ACK to the segment in frame: 1]
        [The RTT to ACK the segment was: 0.000615000 seconds]

No.     Time           Source                Destination           Protocol Length Info
      3 0.000649000    10.0.5.11             10.0.5.22             TCP      66     56753 > krb524 [ACK] Seq=1 Ack=1 Win=29312 Len=0 TSval=2366694 TSecr=2365571

Frame 3: 66 bytes on wire (528 bits), 66 bytes captured (528 bits) on interface 0
    Interface id: 0
    Encapsulation type: Ethernet (1)
    Arrival Time: Mar 15, 2016 09:45:35.684525000 CET
    [Time shift for this packet: 0.000000000 seconds]
    Epoch Time: 1458031535.684525000 seconds
    [Time delta from previous captured frame: 0.000034000 seconds]
    [Time delta from previous displayed frame: 0.000034000 seconds]
    [Time since reference or first frame: 0.000649000 seconds]
    Frame Number: 3
    Frame Length: 66 bytes (528 bits)
    Capture Length: 66 bytes (528 bits)
    [Frame is marked: False]
    [Frame is ignored: False]
    [Protocols in frame: eth:ip:tcp]
    [Coloring Rule Name: TCP]
    [Coloring Rule String: tcp]
Ethernet II, Src: IntelCor_1a:80:15 (68:05:ca:1a:80:15), Dst: IntelCor_1a:7c:75 (68:05:ca:1a:7c:75)
    Destination: IntelCor_1a:7c:75 (68:05:ca:1a:7c:75)
        Address: IntelCor_1a:7c:75 (68:05:ca:1a:7c:75)
        .... ..0. .... .... .... .... = LG bit: Globally unique address (factory default)
        .... ...0 .... .... .... .... = IG bit: Individual address (unicast)
    Source: IntelCor_1a:80:15 (68:05:ca:1a:80:15)
        Address: IntelCor_1a:80:15 (68:05:ca:1a:80:15)
        .... ..0. .... .... .... .... = LG bit: Globally unique address (factory default)
        .... ...0 .... .... .... .... = IG bit: Individual address (unicast)
    Type: IP (0x0800)
Internet Protocol Version 4, Src: 10.0.5.11 (10.0.5.11), Dst: 10.0.5.22 (10.0.5.22)
    Version: 4
    Header length: 20 bytes
    Differentiated Services Field: 0x00 (DSCP 0x00: Default; ECN: 0x00: Not-ECT (Not ECN-Capable Transport))
        0000 00.. = Differentiated Services Codepoint: Default (0x00)
        .... ..00 = Explicit Congestion Notification: Not-ECT (Not ECN-Capable Transport) (0x00)
    Total Length: 52
    Identification: 0x1048 (4168)
    Flags: 0x02 (Don't Fragment)
        0... .... = Reserved bit: Not set
        .1.. .... = Don't fragment: Set
        ..0. .... = More fragments: Not set
    Fragment offset: 0
    Time to live: 64
    Protocol: TCP (6)
    Header checksum: 0x0c5c [validation disabled]
        [Good: False]
        [Bad: False]
    Source: 10.0.5.11 (10.0.5.11)
    Destination: 10.0.5.22 (10.0.5.22)
    [Source GeoIP: Unknown]
    [Destination GeoIP: Unknown]
Transmission Control Protocol, Src Port: 56753 (56753), Dst Port: krb524 (4444), Seq: 1, Ack: 1, Len: 0
    Source port: 56753 (56753)
    Destination port: krb524 (4444)
    [Stream index: 0]
    Sequence number: 1    (relative sequence number)
    Acknowledgment number: 1    (relative ack number)
    Header length: 32 bytes
    Flags: 0x010 (ACK)
        000. .... .... = Reserved: Not set
        ...0 .... .... = Nonce: Not set
        .... 0... .... = Congestion Window Reduced (CWR): Not set
        .... .0.. .... = ECN-Echo: Not set
        .... ..0. .... = Urgent: Not set
        .... ...1 .... = Acknowledgment: Set
        .... .... 0... = Push: Not set
        .... .... .0.. = Reset: Not set
        .... .... ..0. = Syn: Not set
        .... .... ...0 = Fin: Not set
    Window size value: 229
    [Calculated window size: 29312]
    [Window size scaling factor: 128]
    Checksum: 0x1e47 [validation disabled]
        [Good Checksum: False]
        [Bad Checksum: False]
    Options: (12 bytes), No-Operation (NOP), No-Operation (NOP), Timestamps
        No-Operation (NOP)
            Type: 1
                0... .... = Copy on fragmentation: No
                .00. .... = Class: Control (0)
                ...0 0001 = Number: No-Operation (NOP) (1)
        No-Operation (NOP)
            Type: 1
                0... .... = Copy on fragmentation: No
                .00. .... = Class: Control (0)
                ...0 0001 = Number: No-Operation (NOP) (1)
        Timestamps: TSval 2366694, TSecr 2365571
            Kind: Timestamp (8)
            Length: 10
            Timestamp value: 2366694
            Timestamp echo reply: 2365571
    [SEQ/ACK analysis]
        [This is an ACK to the segment in frame: 2]
        [The RTT to ACK the segment was: 0.000034000 seconds]

No.     Time           Source                Destination           Protocol Length Info
      4 0.000773000    10.0.5.11             10.0.5.22             TCP      145    56753 > krb524 [PSH, ACK] Seq=1 Ack=1 Win=29312 Len=79 TSval=2366694 TSecr=2365571

Frame 4: 145 bytes on wire (1160 bits), 145 bytes captured (1160 bits) on interface 0
    Interface id: 0
    Encapsulation type: Ethernet (1)
    Arrival Time: Mar 15, 2016 09:45:35.684649000 CET
    [Time shift for this packet: 0.000000000 seconds]
    Epoch Time: 1458031535.684649000 seconds
    [Time delta from previous captured frame: 0.000124000 seconds]
    [Time delta from previous displayed frame: 0.000124000 seconds]
    [Time since reference or first frame: 0.000773000 seconds]
    Frame Number: 4
    Frame Length: 145 bytes (1160 bits)
    Capture Length: 145 bytes (1160 bits)
    [Frame is marked: False]
    [Frame is ignored: False]
    [Protocols in frame: eth:ip:tcp:data]
    [Coloring Rule Name: TCP]
    [Coloring Rule String: tcp]
Ethernet II, Src: IntelCor_1a:80:15 (68:05:ca:1a:80:15), Dst: IntelCor_1a:7c:75 (68:05:ca:1a:7c:75)
    Destination: IntelCor_1a:7c:75 (68:05:ca:1a:7c:75)
        Address: IntelCor_1a:7c:75 (68:05:ca:1a:7c:75)
        .... ..0. .... .... .... .... = LG bit: Globally unique address (factory default)
        .... ...0 .... .... .... .... = IG bit: Individual address (unicast)
    Source: IntelCor_1a:80:15 (68:05:ca:1a:80:15)
        Address: IntelCor_1a:80:15 (68:05:ca:1a:80:15)
        .... ..0. .... .... .... .... = LG bit: Globally unique address (factory default)
        .... ...0 .... .... .... .... = IG bit: Individual address (unicast)
    Type: IP (0x0800)
Internet Protocol Version 4, Src: 10.0.5.11 (10.0.5.11), Dst: 10.0.5.22 (10.0.5.22)
    Version: 4
    Header length: 20 bytes
    Differentiated Services Field: 0x00 (DSCP 0x00: Default; ECN: 0x00: Not-ECT (Not ECN-Capable Transport))
        0000 00.. = Differentiated Services Codepoint: Default (0x00)
        .... ..00 = Explicit Congestion Notification: Not-ECT (Not ECN-Capable Transport) (0x00)
    Total Length: 131
    Identification: 0x1049 (4169)
    Flags: 0x02 (Don't Fragment)
        0... .... = Reserved bit: Not set
        .1.. .... = Don't fragment: Set
        ..0. .... = More fragments: Not set
    Fragment offset: 0
    Time to live: 64
    Protocol: TCP (6)
    Header checksum: 0x0c0c [validation disabled]
        [Good: False]
        [Bad: False]
    Source: 10.0.5.11 (10.0.5.11)
    Destination: 10.0.5.22 (10.0.5.22)
    [Source GeoIP: Unknown]
    [Destination GeoIP: Unknown]
Transmission Control Protocol, Src Port: 56753 (56753), Dst Port: krb524 (4444), Seq: 1, Ack: 1, Len: 79
    Source port: 56753 (56753)
    Destination port: krb524 (4444)
    [Stream index: 0]
    Sequence number: 1    (relative sequence number)
    [Next sequence number: 80    (relative sequence number)]
    Acknowledgment number: 1    (relative ack number)
    Header length: 32 bytes
    Flags: 0x018 (PSH, ACK)
        000. .... .... = Reserved: Not set
        ...0 .... .... = Nonce: Not set
        .... 0... .... = Congestion Window Reduced (CWR): Not set
        .... .0.. .... = ECN-Echo: Not set
        .... ..0. .... = Urgent: Not set
        .... ...1 .... = Acknowledgment: Set
        .... .... 1... = Push: Set
        .... .... .0.. = Reset: Not set
        .... .... ..0. = Syn: Not set
        .... .... ...0 = Fin: Not set
    Window size value: 229
    [Calculated window size: 29312]
    [Window size scaling factor: 128]
    Checksum: 0x1e96 [validation disabled]
        [Good Checksum: False]
        [Bad Checksum: False]
    Options: (12 bytes), No-Operation (NOP), No-Operation (NOP), Timestamps
        No-Operation (NOP)
            Type: 1
                0... .... = Copy on fragmentation: No
                .00. .... = Class: Control (0)
                ...0 0001 = Number: No-Operation (NOP) (1)
        No-Operation (NOP)
            Type: 1
                0... .... = Copy on fragmentation: No
                .00. .... = Class: Control (0)
                ...0 0001 = Number: No-Operation (NOP) (1)
        Timestamps: TSval 2366694, TSecr 2365571
            Kind: Timestamp (8)
            Length: 10
            Timestamp value: 2366694
            Timestamp echo reply: 2365571
    [SEQ/ACK analysis]
        [Bytes in flight: 79]
Data (79 bytes)

0000  6e 74 74 63 70 40 2d 72 40 2d 6c 31 30 32 34 40   nttcp@-r@-l1024@
0010  2d 6e 31 30 40 2d 66 40 25 39 62 25 38 2e 32 72   -n10@-f@%9b%8.2r
0020  74 25 38 2e 32 63 74 25 31 32 2e 34 72 62 72 25   t%8.2ct%12.4rbr%
0030  31 32 2e 34 63 62 72 25 38 63 25 31 30 2e 32 72   12.4cbr%8c%10.2r
0040  63 72 25 31 30 2e 31 63 63 72 40 2d 4e 31 0a      cr%10.1ccr@-N1.
    Data: 6e74746370402d72402d6c31303234402d6e3130402d6640...
    [Length: 79]

No.     Time           Source                Destination           Protocol Length Info
      5 0.001296000    10.0.5.22             10.0.5.11             TCP      66     krb524 > 56753 [ACK] Seq=1 Ack=80 Win=29056 Len=0 TSval=2365572 TSecr=2366694

Frame 5: 66 bytes on wire (528 bits), 66 bytes captured (528 bits) on interface 0
    Interface id: 0
    Encapsulation type: Ethernet (1)
    Arrival Time: Mar 15, 2016 09:45:35.685172000 CET
    [Time shift for this packet: 0.000000000 seconds]
    Epoch Time: 1458031535.685172000 seconds
    [Time delta from previous captured frame: 0.000523000 seconds]
    [Time delta from previous displayed frame: 0.000523000 seconds]
    [Time since reference or first frame: 0.001296000 seconds]
    Frame Number: 5
    Frame Length: 66 bytes (528 bits)
    Capture Length: 66 bytes (528 bits)
    [Frame is marked: False]
    [Frame is ignored: False]
    [Protocols in frame: eth:ip:tcp]
    [Coloring Rule Name: TCP]
    [Coloring Rule String: tcp]
Ethernet II, Src: IntelCor_1a:7c:75 (68:05:ca:1a:7c:75), Dst: IntelCor_1a:80:15 (68:05:ca:1a:80:15)
    Destination: IntelCor_1a:80:15 (68:05:ca:1a:80:15)
        Address: IntelCor_1a:80:15 (68:05:ca:1a:80:15)
        .... ..0. .... .... .... .... = LG bit: Globally unique address (factory default)
        .... ...0 .... .... .... .... = IG bit: Individual address (unicast)
    Source: IntelCor_1a:7c:75 (68:05:ca:1a:7c:75)
        Address: IntelCor_1a:7c:75 (68:05:ca:1a:7c:75)
        .... ..0. .... .... .... .... = LG bit: Globally unique address (factory default)
        .... ...0 .... .... .... .... = IG bit: Individual address (unicast)
    Type: IP (0x0800)
Internet Protocol Version 4, Src: 10.0.5.22 (10.0.5.22), Dst: 10.0.5.11 (10.0.5.11)
    Version: 4
    Header length: 20 bytes
    Differentiated Services Field: 0x00 (DSCP 0x00: Default; ECN: 0x00: Not-ECT (Not ECN-Capable Transport))
        0000 00.. = Differentiated Services Codepoint: Default (0x00)
        .... ..00 = Explicit Congestion Notification: Not-ECT (Not ECN-Capable Transport) (0x00)
    Total Length: 52
    Identification: 0x3da8 (15784)
    Flags: 0x02 (Don't Fragment)
        0... .... = Reserved bit: Not set
        .1.. .... = Don't fragment: Set
        ..0. .... = More fragments: Not set
    Fragment offset: 0
    Time to live: 64
    Protocol: TCP (6)
    Header checksum: 0xdefb [validation disabled]
        [Good: False]
        [Bad: False]
    Source: 10.0.5.22 (10.0.5.22)
    Destination: 10.0.5.11 (10.0.5.11)
    [Source GeoIP: Unknown]
    [Destination GeoIP: Unknown]
Transmission Control Protocol, Src Port: krb524 (4444), Dst Port: 56753 (56753), Seq: 1, Ack: 80, Len: 0
    Source port: krb524 (4444)
    Destination port: 56753 (56753)
    [Stream index: 0]
    Sequence number: 1    (relative sequence number)
    Acknowledgment number: 80    (relative ack number)
    Header length: 32 bytes
    Flags: 0x010 (ACK)
        000. .... .... = Reserved: Not set
        ...0 .... .... = Nonce: Not set
        .... 0... .... = Congestion Window Reduced (CWR): Not set
        .... .0.. .... = ECN-Echo: Not set
        .... ..0. .... = Urgent: Not set
        .... ...1 .... = Acknowledgment: Set
        .... .... 0... = Push: Not set
        .... .... .0.. = Reset: Not set
        .... .... ..0. = Syn: Not set
        .... .... ...0 = Fin: Not set
    Window size value: 227
    [Calculated window size: 29056]
    [Window size scaling factor: 128]
    Checksum: 0x0751 [validation disabled]
        [Good Checksum: False]
        [Bad Checksum: False]
    Options: (12 bytes), No-Operation (NOP), No-Operation (NOP), Timestamps
        No-Operation (NOP)
            Type: 1
                0... .... = Copy on fragmentation: No
                .00. .... = Class: Control (0)
                ...0 0001 = Number: No-Operation (NOP) (1)
        No-Operation (NOP)
            Type: 1
                0... .... = Copy on fragmentation: No
                .00. .... = Class: Control (0)
                ...0 0001 = Number: No-Operation (NOP) (1)
        Timestamps: TSval 2365572, TSecr 2366694
            Kind: Timestamp (8)
            Length: 10
            Timestamp value: 2365572
            Timestamp echo reply: 2366694
    [SEQ/ACK analysis]
        [This is an ACK to the segment in frame: 4]
        [The RTT to ACK the segment was: 0.000523000 seconds]

No.     Time           Source                Destination           Protocol Length Info
      6 0.003092000    10.0.5.22             10.0.5.11             TCP      81     krb524 > 56753 [PSH, ACK] Seq=1 Ack=80 Win=29056 Len=15 TSval=2365572 TSecr=2366694

Frame 6: 81 bytes on wire (648 bits), 81 bytes captured (648 bits) on interface 0
    Interface id: 0
    Encapsulation type: Ethernet (1)
    Arrival Time: Mar 15, 2016 09:45:35.686968000 CET
    [Time shift for this packet: 0.000000000 seconds]
    Epoch Time: 1458031535.686968000 seconds
    [Time delta from previous captured frame: 0.001796000 seconds]
    [Time delta from previous displayed frame: 0.001796000 seconds]
    [Time since reference or first frame: 0.003092000 seconds]
    Frame Number: 6
    Frame Length: 81 bytes (648 bits)
    Capture Length: 81 bytes (648 bits)
    [Frame is marked: False]
    [Frame is ignored: False]
    [Protocols in frame: eth:ip:tcp:data]
    [Coloring Rule Name: TCP]
    [Coloring Rule String: tcp]
Ethernet II, Src: IntelCor_1a:7c:75 (68:05:ca:1a:7c:75), Dst: IntelCor_1a:80:15 (68:05:ca:1a:80:15)
    Destination: IntelCor_1a:80:15 (68:05:ca:1a:80:15)
        Address: IntelCor_1a:80:15 (68:05:ca:1a:80:15)
        .... ..0. .... .... .... .... = LG bit: Globally unique address (factory default)
        .... ...0 .... .... .... .... = IG bit: Individual address (unicast)
    Source: IntelCor_1a:7c:75 (68:05:ca:1a:7c:75)
        Address: IntelCor_1a:7c:75 (68:05:ca:1a:7c:75)
        .... ..0. .... .... .... .... = LG bit: Globally unique address (factory default)
        .... ...0 .... .... .... .... = IG bit: Individual address (unicast)
    Type: IP (0x0800)
Internet Protocol Version 4, Src: 10.0.5.22 (10.0.5.22), Dst: 10.0.5.11 (10.0.5.11)
    Version: 4
    Header length: 20 bytes
    Differentiated Services Field: 0x00 (DSCP 0x00: Default; ECN: 0x00: Not-ECT (Not ECN-Capable Transport))
        0000 00.. = Differentiated Services Codepoint: Default (0x00)
        .... ..00 = Explicit Congestion Notification: Not-ECT (Not ECN-Capable Transport) (0x00)
    Total Length: 67
    Identification: 0x3da9 (15785)
    Flags: 0x02 (Don't Fragment)
        0... .... = Reserved bit: Not set
        .1.. .... = Don't fragment: Set
        ..0. .... = More fragments: Not set
    Fragment offset: 0
    Time to live: 64
    Protocol: TCP (6)
    Header checksum: 0xdeeb [validation disabled]
        [Good: False]
        [Bad: False]
    Source: 10.0.5.22 (10.0.5.22)
    Destination: 10.0.5.11 (10.0.5.11)
    [Source GeoIP: Unknown]
    [Destination GeoIP: Unknown]
Transmission Control Protocol, Src Port: krb524 (4444), Dst Port: 56753 (56753), Seq: 1, Ack: 80, Len: 15
    Source port: krb524 (4444)
    Destination port: 56753 (56753)
    [Stream index: 0]
    Sequence number: 1    (relative sequence number)
    [Next sequence number: 16    (relative sequence number)]
    Acknowledgment number: 80    (relative ack number)
    Header length: 32 bytes
    Flags: 0x018 (PSH, ACK)
        000. .... .... = Reserved: Not set
        ...0 .... .... = Nonce: Not set
        .... 0... .... = Congestion Window Reduced (CWR): Not set
        .... .0.. .... = ECN-Echo: Not set
        .... ..0. .... = Urgent: Not set
        .... ...1 .... = Acknowledgment: Set
        .... .... 1... = Push: Set
        .... .... .0.. = Reset: Not set
        .... .... ..0. = Syn: Not set
        .... .... ...0 = Fin: Not set
    Window size value: 227
    [Calculated window size: 29056]
    [Window size scaling factor: 128]
    Checksum: 0x9f0a [validation disabled]
        [Good Checksum: False]
        [Bad Checksum: False]
    Options: (12 bytes), No-Operation (NOP), No-Operation (NOP), Timestamps
        No-Operation (NOP)
            Type: 1
                0... .... = Copy on fragmentation: No
                .00. .... = Class: Control (0)
                ...0 0001 = Number: No-Operation (NOP) (1)
        No-Operation (NOP)
            Type: 1
                0... .... = Copy on fragmentation: No
                .00. .... = Class: Control (0)
                ...0 0001 = Number: No-Operation (NOP) (1)
        Timestamps: TSval 2365572, TSecr 2366694
            Kind: Timestamp (8)
            Length: 10
            Timestamp value: 2365572
            Timestamp echo reply: 2366694
    [SEQ/ACK analysis]
        [Bytes in flight: 15]
Data (15 bytes)

0000  64 61 74 61 70 6f 72 74 3a 20 35 30 33 38 0a      dataport: 5038.
    Data: 64617461706f72743a20353033380a
    [Length: 15]

No.     Time           Source                Destination           Protocol Length Info
      7 0.003138000    10.0.5.11             10.0.5.22             TCP      66     56753 > krb524 [ACK] Seq=80 Ack=16 Win=29312 Len=0 TSval=2366695 TSecr=2365572

Frame 7: 66 bytes on wire (528 bits), 66 bytes captured (528 bits) on interface 0
    Interface id: 0
    Encapsulation type: Ethernet (1)
    Arrival Time: Mar 15, 2016 09:45:35.687014000 CET
    [Time shift for this packet: 0.000000000 seconds]
    Epoch Time: 1458031535.687014000 seconds
    [Time delta from previous captured frame: 0.000046000 seconds]
    [Time delta from previous displayed frame: 0.000046000 seconds]
    [Time since reference or first frame: 0.003138000 seconds]
    Frame Number: 7
    Frame Length: 66 bytes (528 bits)
    Capture Length: 66 bytes (528 bits)
    [Frame is marked: False]
    [Frame is ignored: False]
    [Protocols in frame: eth:ip:tcp]
    [Coloring Rule Name: TCP]
    [Coloring Rule String: tcp]
Ethernet II, Src: IntelCor_1a:80:15 (68:05:ca:1a:80:15), Dst: IntelCor_1a:7c:75 (68:05:ca:1a:7c:75)
    Destination: IntelCor_1a:7c:75 (68:05:ca:1a:7c:75)
        Address: IntelCor_1a:7c:75 (68:05:ca:1a:7c:75)
        .... ..0. .... .... .... .... = LG bit: Globally unique address (factory default)
        .... ...0 .... .... .... .... = IG bit: Individual address (unicast)
    Source: IntelCor_1a:80:15 (68:05:ca:1a:80:15)
        Address: IntelCor_1a:80:15 (68:05:ca:1a:80:15)
        .... ..0. .... .... .... .... = LG bit: Globally unique address (factory default)
        .... ...0 .... .... .... .... = IG bit: Individual address (unicast)
    Type: IP (0x0800)
Internet Protocol Version 4, Src: 10.0.5.11 (10.0.5.11), Dst: 10.0.5.22 (10.0.5.22)
    Version: 4
    Header length: 20 bytes
    Differentiated Services Field: 0x00 (DSCP 0x00: Default; ECN: 0x00: Not-ECT (Not ECN-Capable Transport))
        0000 00.. = Differentiated Services Codepoint: Default (0x00)
        .... ..00 = Explicit Congestion Notification: Not-ECT (Not ECN-Capable Transport) (0x00)
    Total Length: 52
    Identification: 0x104a (4170)
    Flags: 0x02 (Don't Fragment)
        0... .... = Reserved bit: Not set
        .1.. .... = Don't fragment: Set
        ..0. .... = More fragments: Not set
    Fragment offset: 0
    Time to live: 64
    Protocol: TCP (6)
    Header checksum: 0x0c5a [validation disabled]
        [Good: False]
        [Bad: False]
    Source: 10.0.5.11 (10.0.5.11)
    Destination: 10.0.5.22 (10.0.5.22)
    [Source GeoIP: Unknown]
    [Destination GeoIP: Unknown]
Transmission Control Protocol, Src Port: 56753 (56753), Dst Port: krb524 (4444), Seq: 80, Ack: 16, Len: 0
    Source port: 56753 (56753)
    Destination port: krb524 (4444)
    [Stream index: 0]
    Sequence number: 80    (relative sequence number)
    Acknowledgment number: 16    (relative ack number)
    Header length: 32 bytes
    Flags: 0x010 (ACK)
        000. .... .... = Reserved: Not set
        ...0 .... .... = Nonce: Not set
        .... 0... .... = Congestion Window Reduced (CWR): Not set
        .... .0.. .... = ECN-Echo: Not set
        .... ..0. .... = Urgent: Not set
        .... ...1 .... = Acknowledgment: Set
        .... .... 0... = Push: Not set
        .... .... .0.. = Reset: Not set
        .... .... ..0. = Syn: Not set
        .... .... ...0 = Fin: Not set
    Window size value: 229
    [Calculated window size: 29312]
    [Window size scaling factor: 128]
    Checksum: 0x1e47 [validation disabled]
        [Good Checksum: False]
        [Bad Checksum: False]
    Options: (12 bytes), No-Operation (NOP), No-Operation (NOP), Timestamps
        No-Operation (NOP)
            Type: 1
                0... .... = Copy on fragmentation: No
                .00. .... = Class: Control (0)
                ...0 0001 = Number: No-Operation (NOP) (1)
        No-Operation (NOP)
            Type: 1
                0... .... = Copy on fragmentation: No
                .00. .... = Class: Control (0)
                ...0 0001 = Number: No-Operation (NOP) (1)
        Timestamps: TSval 2366695, TSecr 2365572
            Kind: Timestamp (8)
            Length: 10
            Timestamp value: 2366695
            Timestamp echo reply: 2365572
    [SEQ/ACK analysis]
        [This is an ACK to the segment in frame: 6]
        [The RTT to ACK the segment was: 0.000046000 seconds]

No.     Time           Source                Destination           Protocol Length Info
      8 0.003176000    10.0.5.11             10.0.5.22             TCP      74     35401 > 5038 [SYN] Seq=0 Win=29200 Len=0 MSS=1460 SACK_PERM=1 TSval=2366695 TSecr=0 WS=128

Frame 8: 74 bytes on wire (592 bits), 74 bytes captured (592 bits) on interface 0
    Interface id: 0
    Encapsulation type: Ethernet (1)
    Arrival Time: Mar 15, 2016 09:45:35.687052000 CET
    [Time shift for this packet: 0.000000000 seconds]
    Epoch Time: 1458031535.687052000 seconds
    [Time delta from previous captured frame: 0.000038000 seconds]
    [Time delta from previous displayed frame: 0.000038000 seconds]
    [Time since reference or first frame: 0.003176000 seconds]
    Frame Number: 8
    Frame Length: 74 bytes (592 bits)
    Capture Length: 74 bytes (592 bits)
    [Frame is marked: False]
    [Frame is ignored: False]
    [Protocols in frame: eth:ip:tcp]
    [Coloring Rule Name: TCP SYN/FIN]
    [Coloring Rule String: tcp.flags & 0x02 || tcp.flags.fin == 1]
Ethernet II, Src: IntelCor_1a:80:15 (68:05:ca:1a:80:15), Dst: IntelCor_1a:7c:75 (68:05:ca:1a:7c:75)
    Destination: IntelCor_1a:7c:75 (68:05:ca:1a:7c:75)
        Address: IntelCor_1a:7c:75 (68:05:ca:1a:7c:75)
        .... ..0. .... .... .... .... = LG bit: Globally unique address (factory default)
        .... ...0 .... .... .... .... = IG bit: Individual address (unicast)
    Source: IntelCor_1a:80:15 (68:05:ca:1a:80:15)
        Address: IntelCor_1a:80:15 (68:05:ca:1a:80:15)
        .... ..0. .... .... .... .... = LG bit: Globally unique address (factory default)
        .... ...0 .... .... .... .... = IG bit: Individual address (unicast)
    Type: IP (0x0800)
Internet Protocol Version 4, Src: 10.0.5.11 (10.0.5.11), Dst: 10.0.5.22 (10.0.5.22)
    Version: 4
    Header length: 20 bytes
    Differentiated Services Field: 0x00 (DSCP 0x00: Default; ECN: 0x00: Not-ECT (Not ECN-Capable Transport))
        0000 00.. = Differentiated Services Codepoint: Default (0x00)
        .... ..00 = Explicit Congestion Notification: Not-ECT (Not ECN-Capable Transport) (0x00)
    Total Length: 60
    Identification: 0x9b76 (39798)
    Flags: 0x02 (Don't Fragment)
        0... .... = Reserved bit: Not set
        .1.. .... = Don't fragment: Set
        ..0. .... = More fragments: Not set
    Fragment offset: 0
    Time to live: 64
    Protocol: TCP (6)
    Header checksum: 0x8125 [validation disabled]
        [Good: False]
        [Bad: False]
    Source: 10.0.5.11 (10.0.5.11)
    Destination: 10.0.5.22 (10.0.5.22)
    [Source GeoIP: Unknown]
    [Destination GeoIP: Unknown]
Transmission Control Protocol, Src Port: 35401 (35401), Dst Port: 5038 (5038), Seq: 0, Len: 0
    Source port: 35401 (35401)
    Destination port: 5038 (5038)
    [Stream index: 1]
    Sequence number: 0    (relative sequence number)
    Header length: 40 bytes
    Flags: 0x002 (SYN)
        000. .... .... = Reserved: Not set
        ...0 .... .... = Nonce: Not set
        .... 0... .... = Congestion Window Reduced (CWR): Not set
        .... .0.. .... = ECN-Echo: Not set
        .... ..0. .... = Urgent: Not set
        .... ...0 .... = Acknowledgment: Not set
        .... .... 0... = Push: Not set
        .... .... .0.. = Reset: Not set
        .... .... ..1. = Syn: Set
            [Expert Info (Chat/Sequence): Connection establish request (SYN): server port 5038]
                [Message: Connection establish request (SYN): server port 5038]
                [Severity level: Chat]
                [Group: Sequence]
        .... .... ...0 = Fin: Not set
    Window size value: 29200
    [Calculated window size: 29200]
    Checksum: 0x1e4f [validation disabled]
        [Good Checksum: False]
        [Bad Checksum: False]
    Options: (20 bytes), Maximum segment size, SACK permitted, Timestamps, No-Operation (NOP), Window scale
        Maximum segment size: 1460 bytes
            Kind: MSS size (2)
            Length: 4
            MSS Value: 1460
        TCP SACK Permitted Option: True
            Kind: SACK Permission (4)
            Length: 2
        Timestamps: TSval 2366695, TSecr 0
            Kind: Timestamp (8)
            Length: 10
            Timestamp value: 2366695
            Timestamp echo reply: 0
        No-Operation (NOP)
            Type: 1
                0... .... = Copy on fragmentation: No
                .00. .... = Class: Control (0)
                ...0 0001 = Number: No-Operation (NOP) (1)
        Window scale: 7 (multiply by 128)
            Kind: Window Scale (3)
            Length: 3
            Shift count: 7
            [Multiplier: 128]

No.     Time           Source                Destination           Protocol Length Info
      9 0.003740000    10.0.5.22             10.0.5.11             TCP      74     5038 > 35401 [SYN, ACK] Seq=0 Ack=1 Win=28960 Len=0 MSS=1460 SACK_PERM=1 TSval=2365572 TSecr=2366695 WS=128

Frame 9: 74 bytes on wire (592 bits), 74 bytes captured (592 bits) on interface 0
    Interface id: 0
    Encapsulation type: Ethernet (1)
    Arrival Time: Mar 15, 2016 09:45:35.687616000 CET
    [Time shift for this packet: 0.000000000 seconds]
    Epoch Time: 1458031535.687616000 seconds
    [Time delta from previous captured frame: 0.000564000 seconds]
    [Time delta from previous displayed frame: 0.000564000 seconds]
    [Time since reference or first frame: 0.003740000 seconds]
    Frame Number: 9
    Frame Length: 74 bytes (592 bits)
    Capture Length: 74 bytes (592 bits)
    [Frame is marked: False]
    [Frame is ignored: False]
    [Protocols in frame: eth:ip:tcp]
    [Coloring Rule Name: TCP SYN/FIN]
    [Coloring Rule String: tcp.flags & 0x02 || tcp.flags.fin == 1]
Ethernet II, Src: IntelCor_1a:7c:75 (68:05:ca:1a:7c:75), Dst: IntelCor_1a:80:15 (68:05:ca:1a:80:15)
    Destination: IntelCor_1a:80:15 (68:05:ca:1a:80:15)
        Address: IntelCor_1a:80:15 (68:05:ca:1a:80:15)
        .... ..0. .... .... .... .... = LG bit: Globally unique address (factory default)
        .... ...0 .... .... .... .... = IG bit: Individual address (unicast)
    Source: IntelCor_1a:7c:75 (68:05:ca:1a:7c:75)
        Address: IntelCor_1a:7c:75 (68:05:ca:1a:7c:75)
        .... ..0. .... .... .... .... = LG bit: Globally unique address (factory default)
        .... ...0 .... .... .... .... = IG bit: Individual address (unicast)
    Type: IP (0x0800)
Internet Protocol Version 4, Src: 10.0.5.22 (10.0.5.22), Dst: 10.0.5.11 (10.0.5.11)
    Version: 4
    Header length: 20 bytes
    Differentiated Services Field: 0x00 (DSCP 0x00: Default; ECN: 0x00: Not-ECT (Not ECN-Capable Transport))
        0000 00.. = Differentiated Services Codepoint: Default (0x00)
        .... ..00 = Explicit Congestion Notification: Not-ECT (Not ECN-Capable Transport) (0x00)
    Total Length: 60
    Identification: 0x0000 (0)
    Flags: 0x02 (Don't Fragment)
        0... .... = Reserved bit: Not set
        .1.. .... = Don't fragment: Set
        ..0. .... = More fragments: Not set
    Fragment offset: 0
    Time to live: 64
    Protocol: TCP (6)
    Header checksum: 0x1c9c [validation disabled]
        [Good: False]
        [Bad: False]
    Source: 10.0.5.22 (10.0.5.22)
    Destination: 10.0.5.11 (10.0.5.11)
    [Source GeoIP: Unknown]
    [Destination GeoIP: Unknown]
Transmission Control Protocol, Src Port: 5038 (5038), Dst Port: 35401 (35401), Seq: 0, Ack: 1, Len: 0
    Source port: 5038 (5038)
    Destination port: 35401 (35401)
    [Stream index: 1]
    Sequence number: 0    (relative sequence number)
    Acknowledgment number: 1    (relative ack number)
    Header length: 40 bytes
    Flags: 0x012 (SYN, ACK)
        000. .... .... = Reserved: Not set
        ...0 .... .... = Nonce: Not set
        .... 0... .... = Congestion Window Reduced (CWR): Not set
        .... .0.. .... = ECN-Echo: Not set
        .... ..0. .... = Urgent: Not set
        .... ...1 .... = Acknowledgment: Set
        .... .... 0... = Push: Not set
