No.     Time           Source                Destination           Protocol Length Info
      1 0.000000000    10.0.1.11             10.0.2.22             TCP      74     42792 > 4444 [SYN] Seq=0 Win=29200 Len=0 MSS=1460 SACK_PERM=1 TSval=4062786 TSecr=0 WS=128

Frame 1: 74 bytes on wire (592 bits), 74 bytes captured (592 bits) on interface 0
    Interface id: 0
    Encapsulation type: Ethernet (1)
    Arrival Time: Mar 15, 2016 11:38:53.694097000 CET
    [Time shift for this packet: 0.000000000 seconds]
    Epoch Time: 1458038333.694097000 seconds
    [Time delta from previous captured frame: 0.000000000 seconds]
    [Time delta from previous displayed frame: 0.000000000 seconds]
    [Time since reference or first frame: 0.000000000 seconds]
    Frame Number: 1
    Frame Length: 74 bytes (592 bits)
    Capture Length: 74 bytes (592 bits)
    [Frame is marked: False]
    [Frame is ignored: False]
    [Protocols in frame: eth:ip:tcp]
    [Coloring Rule Name: TCP SYN/FIN]
    [Coloring Rule String: tcp.flags & 0x02 || tcp.flags.fin == 1]
Ethernet II, Src: 68:05:ca:1a:7c:70 (68:05:ca:1a:7c:70), Dst: 68:05:ca:1a:80:18 (68:05:ca:1a:80:18)
    Destination: 68:05:ca:1a:80:18 (68:05:ca:1a:80:18)
        Address: 68:05:ca:1a:80:18 (68:05:ca:1a:80:18)
        .... ..0. .... .... .... .... = LG bit: Globally unique address (factory default)
        .... ...0 .... .... .... .... = IG bit: Individual address (unicast)
    Source: 68:05:ca:1a:7c:70 (68:05:ca:1a:7c:70)
        Address: 68:05:ca:1a:7c:70 (68:05:ca:1a:7c:70)
        .... ..0. .... .... .... .... = LG bit: Globally unique address (factory default)
        .... ...0 .... .... .... .... = IG bit: Individual address (unicast)
    Type: IP (0x0800)
Internet Protocol Version 4, Src: 10.0.1.11 (10.0.1.11), Dst: 10.0.2.22 (10.0.2.22)
    Version: 4
    Header length: 20 bytes
    Differentiated Services Field: 0x00 (DSCP 0x00: Default; ECN: 0x00: Not-ECT (Not ECN-Capable Transport))
        0000 00.. = Differentiated Services Codepoint: Default (0x00)
        .... ..00 = Explicit Congestion Notification: Not-ECT (Not ECN-Capable Transport) (0x00)
    Total Length: 60
    Identification: 0x06d2 (1746)
    Flags: 0x02 (Don't Fragment)
        0... .... = Reserved bit: Not set
        .1.. .... = Don't fragment: Set
        ..0. .... = More fragments: Not set
    Fragment offset: 0
    Time to live: 64
    Protocol: TCP (6)
    Header checksum: 0x1cca [validation disabled]
        [Good: False]
        [Bad: False]
    Source: 10.0.1.11 (10.0.1.11)
    Destination: 10.0.2.22 (10.0.2.22)
    [Source GeoIP: Unknown]
    [Destination GeoIP: Unknown]
Transmission Control Protocol, Src Port: 42792 (42792), Dst Port: 4444 (4444), Seq: 0, Len: 0
    Source port: 42792 (42792)
    Destination port: 4444 (4444)
    [Stream index: 0]
    Sequence number: 0    (relative sequence number)
    Header length: 40 bytes
    Flags: 0x002 (SYN)
        000. .... .... = Reserved: Not set
        ...0 .... .... = Nonce: Not set
        .... 0... .... = Congestion Window Reduced (CWR): Not set
        .... .0.. .... = ECN-Echo: Not set
        .... ..0. .... = Urgent: Not set
        .... ...0 .... = Acknowledgment: Not set
        .... .... 0... = Push: Not set
        .... .... .0.. = Reset: Not set
        .... .... ..1. = Syn: Set
            [Expert Info (Chat/Sequence): Connection establish request (SYN): server port 4444]
                [Message: Connection establish request (SYN): server port 4444]
                [Severity level: Chat]
                [Group: Sequence]
        .... .... ...0 = Fin: Not set
    Window size value: 29200
    [Calculated window size: 29200]
    Checksum: 0x0a36 [validation disabled]
        [Good Checksum: False]
        [Bad Checksum: False]
    Options: (20 bytes), Maximum segment size, SACK permitted, Timestamps, No-Operation (NOP), Window scale
        Maximum segment size: 1460 bytes
            Kind: MSS size (2)
            Length: 4
            MSS Value: 1460
        TCP SACK Permitted Option: True
            Kind: SACK Permission (4)
            Length: 2
        Timestamps: TSval 4062786, TSecr 0
            Kind: Timestamp (8)
            Length: 10
            Timestamp value: 4062786
            Timestamp echo reply: 0
        No-Operation (NOP)
            Type: 1
                0... .... = Copy on fragmentation: No
                .00. .... = Class: Control (0)
                ...0 0001 = Number: No-Operation (NOP) (1)
        Window scale: 7 (multiply by 128)
            Kind: Window Scale (3)
            Length: 3
            Shift count: 7
            [Multiplier: 128]

No.     Time           Source                Destination           Protocol Length Info
      2 0.001177000    10.0.2.22             10.0.1.11             TCP      74     4444 > 42792 [SYN, ACK] Seq=0 Ack=1 Win=8960 Len=0 MSS=460 SACK_PERM=1 TSval=4061660 TSecr=4062786 WS=128

Frame 2: 74 bytes on wire (592 bits), 74 bytes captured (592 bits) on interface 0
    Interface id: 0
    Encapsulation type: Ethernet (1)
    Arrival Time: Mar 15, 2016 11:38:53.695274000 CET
    [Time shift for this packet: 0.000000000 seconds]
    Epoch Time: 1458038333.695274000 seconds
    [Time delta from previous captured frame: 0.001177000 seconds]
    [Time delta from previous displayed frame: 0.001177000 seconds]
    [Time since reference or first frame: 0.001177000 seconds]
    Frame Number: 2
    Frame Length: 74 bytes (592 bits)
    Capture Length: 74 bytes (592 bits)
    [Frame is marked: False]
    [Frame is ignored: False]
    [Protocols in frame: eth:ip:tcp]
Ethernet II, Src: 68:05:ca:1a:80:18 (68:05:ca:1a:80:18), Dst: 68:05:ca:1a:7c:70 (68:05:ca:1a:7c:70)
    Destination: 68:05:ca:1a:7c:70 (68:05:ca:1a:7c:70)
        Address: 68:05:ca:1a:7c:70 (68:05:ca:1a:7c:70)
        .... ..0. .... .... .... .... = LG bit: Globally unique address (factory default)
        .... ...0 .... .... .... .... = IG bit: Individual address (unicast)
    Source: 68:05:ca:1a:80:18 (68:05:ca:1a:80:18)
        Address: 68:05:ca:1a:80:18 (68:05:ca:1a:80:18)
        .... ..0. .... .... .... .... = LG bit: Globally unique address (factory default)
        .... ...0 .... .... .... .... = IG bit: Individual address (unicast)
    Type: IP (0x0800)
Internet Protocol Version 4, Src: 10.0.2.22 (10.0.2.22), Dst: 10.0.1.11 (10.0.1.11)
    Version: 4
    Header length: 20 bytes
    Differentiated Services Field: 0x00 (DSCP 0x00: Default; ECN: 0x00: Not-ECT (Not ECN-Capable Transport))
        0000 00.. = Differentiated Services Codepoint: Default (0x00)
        .... ..00 = Explicit Congestion Notification: Not-ECT (Not ECN-Capable Transport) (0x00)
    Total Length: 60
    Identification: 0x0000 (0)
    Flags: 0x02 (Don't Fragment)
        0... .... = Reserved bit: Not set
        .1.. .... = Don't fragment: Set
        ..0. .... = More fragments: Not set
    Fragment offset: 0
    Time to live: 63
    Protocol: TCP (6)
    Header checksum: 0x249c [validation disabled]
        [Good: False]
        [Bad: False]
    Source: 10.0.2.22 (10.0.2.22)
    Destination: 10.0.1.11 (10.0.1.11)
    [Source GeoIP: Unknown]
    [Destination GeoIP: Unknown]
Transmission Control Protocol, Src Port: 4444 (4444), Dst Port: 42792 (42792), Seq: 0, Ack: 1, Len: 0
    Source port: 4444 (4444)
    Destination port: 42792 (42792)
    [Stream index: 0]
    Sequence number: 0    (relative sequence number)
    Acknowledgment number: 1    (relative ack number)
    Header length: 40 bytes
    Flags: 0x012 (SYN, ACK)
        000. .... .... = Reserved: Not set
        ...0 .... .... = Nonce: Not set
        .... 0... .... = Congestion Window Reduced (CWR): Not set
        .... .0.. .... = ECN-Echo: Not set
        .... ..0. .... = Urgent: Not set
        .... ...1 .... = Acknowledgment: Set
        .... .... 0... = Push: Not set
        .... .... .0.. = Reset: Not set
        .... .... ..1. = Syn: Set
            [Expert Info (Chat/Sequence): Connection establish acknowledge (SYN+ACK): server port 4444]
                [Message: Connection establish acknowledge (SYN+ACK): server port 4444]
                [Severity level: Chat]
                [Group: Sequence]
        .... .... ...0 = Fin: Not set
    Window size value: 8960
    [Calculated window size: 8960]
    Checksum: 0x5ed5 [validation disabled]
        [Good Checksum: False]
        [Bad Checksum: False]
    Options: (20 bytes), Maximum segment size, SACK permitted, Timestamps, No-Operation (NOP), Window scale
        Maximum segment size: 460 bytes
            Kind: MSS size (2)
            Length: 4
            MSS Value: 460
        TCP SACK Permitted Option: True
            Kind: SACK Permission (4)
            Length: 2
        Timestamps: TSval 4061660, TSecr 4062786
            Kind: Timestamp (8)
            Length: 10
            Timestamp value: 4061660
            Timestamp echo reply: 4062786
        No-Operation (NOP)
            Type: 1
                0... .... = Copy on fragmentation: No
                .00. .... = Class: Control (0)
                ...0 0001 = Number: No-Operation (NOP) (1)
        Window scale: 7 (multiply by 128)
            Kind: Window Scale (3)
            Length: 3
            Shift count: 7
            [Multiplier: 128]
    [SEQ/ACK analysis]
        [This is an ACK to the segment in frame: 1]
        [The RTT to ACK the segment was: 0.001177000 seconds]

No.     Time           Source                Destination           Protocol Length Info
      3 0.001674000    10.0.1.11             10.0.2.22             TCP      66     42792 > 4444 [ACK] Seq=1 Ack=1 Win=29312 Len=0 TSval=4062787 TSecr=4061660

Frame 3: 66 bytes on wire (528 bits), 66 bytes captured (528 bits) on interface 0
    Interface id: 0
    Encapsulation type: Ethernet (1)
    Arrival Time: Mar 15, 2016 11:38:53.695771000 CET
    [Time shift for this packet: 0.000000000 seconds]
    Epoch Time: 1458038333.695771000 seconds
    [Time delta from previous captured frame: 0.000497000 seconds]
    [Time delta from previous displayed frame: 0.000497000 seconds]
    [Time since reference or first frame: 0.001674000 seconds]
    Frame Number: 3
    Frame Length: 66 bytes (528 bits)
    Capture Length: 66 bytes (528 bits)
    [Frame is marked: False]
    [Frame is ignored: False]
    [Protocols in frame: eth:ip:tcp]
Ethernet II, Src: 68:05:ca:1a:7c:70 (68:05:ca:1a:7c:70), Dst: 68:05:ca:1a:80:18 (68:05:ca:1a:80:18)
    Destination: 68:05:ca:1a:80:18 (68:05:ca:1a:80:18)
        Address: 68:05:ca:1a:80:18 (68:05:ca:1a:80:18)
        .... ..0. .... .... .... .... = LG bit: Globally unique address (factory default)
        .... ...0 .... .... .... .... = IG bit: Individual address (unicast)
    Source: 68:05:ca:1a:7c:70 (68:05:ca:1a:7c:70)
        Address: 68:05:ca:1a:7c:70 (68:05:ca:1a:7c:70)
        .... ..0. .... .... .... .... = LG bit: Globally unique address (factory default)
        .... ...0 .... .... .... .... = IG bit: Individual address (unicast)
    Type: IP (0x0800)
Internet Protocol Version 4, Src: 10.0.1.11 (10.0.1.11), Dst: 10.0.2.22 (10.0.2.22)
    Version: 4
    Header length: 20 bytes
    Differentiated Services Field: 0x00 (DSCP 0x00: Default; ECN: 0x00: Not-ECT (Not ECN-Capable Transport))
        0000 00.. = Differentiated Services Codepoint: Default (0x00)
        .... ..00 = Explicit Congestion Notification: Not-ECT (Not ECN-Capable Transport) (0x00)
    Total Length: 52
    Identification: 0x06d3 (1747)
    Flags: 0x02 (Don't Fragment)
        0... .... = Reserved bit: Not set
        .1.. .... = Don't fragment: Set
        ..0. .... = More fragments: Not set
    Fragment offset: 0
    Time to live: 64
    Protocol: TCP (6)
    Header checksum: 0x1cd1 [validation disabled]
        [Good: False]
        [Bad: False]
    Source: 10.0.1.11 (10.0.1.11)
    Destination: 10.0.2.22 (10.0.2.22)
    [Source GeoIP: Unknown]
    [Destination GeoIP: Unknown]
Transmission Control Protocol, Src Port: 42792 (42792), Dst Port: 4444 (4444), Seq: 1, Ack: 1, Len: 0
    Source port: 42792 (42792)
    Destination port: 4444 (4444)
    [Stream index: 0]
    Sequence number: 1    (relative sequence number)
    Acknowledgment number: 1    (relative ack number)
    Header length: 32 bytes
    Flags: 0x010 (ACK)
        000. .... .... = Reserved: Not set
        ...0 .... .... = Nonce: Not set
        .... 0... .... = Congestion Window Reduced (CWR): Not set
        .... .0.. .... = ECN-Echo: Not set
        .... ..0. .... = Urgent: Not set
        .... ...1 .... = Acknowledgment: Set
        .... .... 0... = Push: Not set
        .... .... .0.. = Reset: Not set
        .... .... ..0. = Syn: Not set
        .... .... ...0 = Fin: Not set
    Window size value: 229
    [Calculated window size: 29312]
    [Window size scaling factor: 128]
    Checksum: 0xabd3 [validation disabled]
        [Good Checksum: False]
        [Bad Checksum: False]
    Options: (12 bytes), No-Operation (NOP), No-Operation (NOP), Timestamps
        No-Operation (NOP)
            Type: 1
                0... .... = Copy on fragmentation: No
                .00. .... = Class: Control (0)
                ...0 0001 = Number: No-Operation (NOP) (1)
        No-Operation (NOP)
            Type: 1
                0... .... = Copy on fragmentation: No
                .00. .... = Class: Control (0)
                ...0 0001 = Number: No-Operation (NOP) (1)
        Timestamps: TSval 4062787, TSecr 4061660
            Kind: Timestamp (8)
            Length: 10
            Timestamp value: 4062787
            Timestamp echo reply: 4061660
    [SEQ/ACK analysis]
        [This is an ACK to the segment in frame: 2]
        [The RTT to ACK the segment was: 0.000497000 seconds]

No.     Time           Source                Destination           Protocol Length Info
      4 0.001925000    10.0.1.11             10.0.2.22             TCP      144    42792 > 4444 [PSH, ACK] Seq=1 Ack=1 Win=29312 Len=78 TSval=4062787 TSecr=4061660

Frame 4: 144 bytes on wire (1152 bits), 144 bytes captured (1152 bits) on interface 0
    Interface id: 0
    Encapsulation type: Ethernet (1)
    Arrival Time: Mar 15, 2016 11:38:53.696022000 CET
    [Time shift for this packet: 0.000000000 seconds]
    Epoch Time: 1458038333.696022000 seconds
    [Time delta from previous captured frame: 0.000251000 seconds]
    [Time delta from previous displayed frame: 0.000251000 seconds]
    [Time since reference or first frame: 0.001925000 seconds]
    Frame Number: 4
    Frame Length: 144 bytes (1152 bits)
    Capture Length: 144 bytes (1152 bits)
    [Frame is marked: False]
    [Frame is ignored: False]
    [Protocols in frame: eth:ip:tcp:data]
Ethernet II, Src: 68:05:ca:1a:7c:70 (68:05:ca:1a:7c:70), Dst: 68:05:ca:1a:80:18 (68:05:ca:1a:80:18)
    Destination: 68:05:ca:1a:80:18 (68:05:ca:1a:80:18)
        Address: 68:05:ca:1a:80:18 (68:05:ca:1a:80:18)
        .... ..0. .... .... .... .... = LG bit: Globally unique address (factory default)
        .... ...0 .... .... .... .... = IG bit: Individual address (unicast)
    Source: 68:05:ca:1a:7c:70 (68:05:ca:1a:7c:70)
        Address: 68:05:ca:1a:7c:70 (68:05:ca:1a:7c:70)
        .... ..0. .... .... .... .... = LG bit: Globally unique address (factory default)
        .... ...0 .... .... .... .... = IG bit: Individual address (unicast)
    Type: IP (0x0800)
Internet Protocol Version 4, Src: 10.0.1.11 (10.0.1.11), Dst: 10.0.2.22 (10.0.2.22)
    Version: 4
    Header length: 20 bytes
    Differentiated Services Field: 0x00 (DSCP 0x00: Default; ECN: 0x00: Not-ECT (Not ECN-Capable Transport))
        0000 00.. = Differentiated Services Codepoint: Default (0x00)
        .... ..00 = Explicit Congestion Notification: Not-ECT (Not ECN-Capable Transport) (0x00)
    Total Length: 130
    Identification: 0x06d4 (1748)
    Flags: 0x02 (Don't Fragment)
        0... .... = Reserved bit: Not set
        .1.. .... = Don't fragment: Set
        ..0. .... = More fragments: Not set
    Fragment offset: 0
    Time to live: 64
    Protocol: TCP (6)
    Header checksum: 0x1c82 [validation disabled]
        [Good: False]
        [Bad: False]
    Source: 10.0.1.11 (10.0.1.11)
    Destination: 10.0.2.22 (10.0.2.22)
    [Source GeoIP: Unknown]
    [Destination GeoIP: Unknown]
Transmission Control Protocol, Src Port: 42792 (42792), Dst Port: 4444 (4444), Seq: 1, Ack: 1, Len: 78
    Source port: 42792 (42792)
    Destination port: 4444 (4444)
    [Stream index: 0]
    Sequence number: 1    (relative sequence number)
    [Next sequence number: 79    (relative sequence number)]
    Acknowledgment number: 1    (relative ack number)
    Header length: 32 bytes
    Flags: 0x018 (PSH, ACK)
        000. .... .... = Reserved: Not set
        ...0 .... .... = Nonce: Not set
        .... 0... .... = Congestion Window Reduced (CWR): Not set
        .... .0.. .... = ECN-Echo: Not set
        .... ..0. .... = Urgent: Not set
        .... ...1 .... = Acknowledgment: Set
        .... .... 1... = Push: Set
        .... .... .0.. = Reset: Not set
        .... .... ..0. = Syn: Not set
        .... .... ...0 = Fin: Not set
    Window size value: 229
    [Calculated window size: 29312]
    [Window size scaling factor: 128]
    Checksum: 0x5aa9 [validation disabled]
        [Good Checksum: False]
        [Bad Checksum: False]
    Options: (12 bytes), No-Operation (NOP), No-Operation (NOP), Timestamps
        No-Operation (NOP)
            Type: 1
                0... .... = Copy on fragmentation: No
                .00. .... = Class: Control (0)
                ...0 0001 = Number: No-Operation (NOP) (1)
        No-Operation (NOP)
            Type: 1
                0... .... = Copy on fragmentation: No
                .00. .... = Class: Control (0)
                ...0 0001 = Number: No-Operation (NOP) (1)
        Timestamps: TSval 4062787, TSecr 4061660
            Kind: Timestamp (8)
            Length: 10
            Timestamp value: 4062787
            Timestamp echo reply: 4061660
    [SEQ/ACK analysis]
        [Bytes in flight: 78]
Data (78 bytes)

0000  6e 74 74 63 70 40 2d 72 40 2d 6c 31 30 32 34 40   nttcp@-r@-l1024@
0010  2d 6e 32 40 2d 66 40 25 39 62 25 38 2e 32 72 74   -n2@-f@%9b%8.2rt
0020  25 38 2e 32 63 74 25 31 32 2e 34 72 62 72 25 31   %8.2ct%12.4rbr%1
0030  32 2e 34 63 62 72 25 38 63 25 31 30 2e 32 72 63   2.4cbr%8c%10.2rc
0040  72 25 31 30 2e 31 63 63 72 40 2d 4e 31 0a         r%10.1ccr@-N1.
    Data: 6e74746370402d72402d6c31303234402d6e32402d664025...
    [Length: 78]

No.     Time           Source                Destination           Protocol Length Info
      5 0.002408000    10.0.2.22             10.0.1.11             TCP      66     4444 > 42792 [ACK] Seq=1 Ack=79 Win=8960 Len=0 TSval=4061660 TSecr=4062787

Frame 5: 66 bytes on wire (528 bits), 66 bytes captured (528 bits) on interface 0
    Interface id: 0
    Encapsulation type: Ethernet (1)
    Arrival Time: Mar 15, 2016 11:38:53.696505000 CET
    [Time shift for this packet: 0.000000000 seconds]
    Epoch Time: 1458038333.696505000 seconds
    [Time delta from previous captured frame: 0.000483000 seconds]
    [Time delta from previous displayed frame: 0.000483000 seconds]
    [Time since reference or first frame: 0.002408000 seconds]
    Frame Number: 5
    Frame Length: 66 bytes (528 bits)
    Capture Length: 66 bytes (528 bits)
    [Frame is marked: False]
    [Frame is ignored: False]
    [Protocols in frame: eth:ip:tcp]
Ethernet II, Src: 68:05:ca:1a:80:18 (68:05:ca:1a:80:18), Dst: 68:05:ca:1a:7c:70 (68:05:ca:1a:7c:70)
    Destination: 68:05:ca:1a:7c:70 (68:05:ca:1a:7c:70)
        Address: 68:05:ca:1a:7c:70 (68:05:ca:1a:7c:70)
        .... ..0. .... .... .... .... = LG bit: Globally unique address (factory default)
        .... ...0 .... .... .... .... = IG bit: Individual address (unicast)
    Source: 68:05:ca:1a:80:18 (68:05:ca:1a:80:18)
        Address: 68:05:ca:1a:80:18 (68:05:ca:1a:80:18)
        .... ..0. .... .... .... .... = LG bit: Globally unique address (factory default)
        .... ...0 .... .... .... .... = IG bit: Individual address (unicast)
    Type: IP (0x0800)
Internet Protocol Version 4, Src: 10.0.2.22 (10.0.2.22), Dst: 10.0.1.11 (10.0.1.11)
    Version: 4
    Header length: 20 bytes
    Differentiated Services Field: 0x00 (DSCP 0x00: Default; ECN: 0x00: Not-ECT (Not ECN-Capable Transport))
        0000 00.. = Differentiated Services Codepoint: Default (0x00)
        .... ..00 = Explicit Congestion Notification: Not-ECT (Not ECN-Capable Transport) (0x00)
    Total Length: 52
    Identification: 0x724d (29261)
    Flags: 0x02 (Don't Fragment)
        0... .... = Reserved bit: Not set
        .1.. .... = Don't fragment: Set
        ..0. .... = More fragments: Not set
    Fragment offset: 0
    Time to live: 63
    Protocol: TCP (6)
    Header checksum: 0xb256 [validation disabled]
        [Good: False]
        [Bad: False]
    Source: 10.0.2.22 (10.0.2.22)
    Destination: 10.0.1.11 (10.0.1.11)
    [Source GeoIP: Unknown]
    [Destination GeoIP: Unknown]
Transmission Control Protocol, Src Port: 4444 (4444), Dst Port: 42792 (42792), Seq: 1, Ack: 79, Len: 0
    Source port: 4444 (4444)
    Destination port: 42792 (42792)
    [Stream index: 0]
    Sequence number: 1    (relative sequence number)
    Acknowledgment number: 79    (relative ack number)
    Header length: 32 bytes
    Flags: 0x010 (ACK)
        000. .... .... = Reserved: Not set
        ...0 .... .... = Nonce: Not set
        .... 0... .... = Congestion Window Reduced (CWR): Not set
        .... .0.. .... = ECN-Echo: Not set
        .... ..0. .... = Urgent: Not set
        .... ...1 .... = Acknowledgment: Set
        .... .... 0... = Push: Not set
        .... .... .0.. = Reset: Not set
        .... .... ..0. = Syn: Not set
        .... .... ...0 = Fin: Not set
    Window size value: 70
    [Calculated window size: 8960]
    [Window size scaling factor: 128]
    Checksum: 0xac24 [validation disabled]
        [Good Checksum: False]
        [Bad Checksum: False]
    Options: (12 bytes), No-Operation (NOP), No-Operation (NOP), Timestamps
        No-Operation (NOP)
            Type: 1
                0... .... = Copy on fragmentation: No
                .00. .... = Class: Control (0)
                ...0 0001 = Number: No-Operation (NOP) (1)
        No-Operation (NOP)
            Type: 1
                0... .... = Copy on fragmentation: No
                .00. .... = Class: Control (0)
                ...0 0001 = Number: No-Operation (NOP) (1)
        Timestamps: TSval 4061660, TSecr 4062787
            Kind: Timestamp (8)
            Length: 10
            Timestamp value: 4061660
            Timestamp echo reply: 4062787
    [SEQ/ACK analysis]
        [This is an ACK to the segment in frame: 4]
        [The RTT to ACK the segment was: 0.000483000 seconds]

No.     Time           Source                Destination           Protocol Length Info
      6 0.004213000    10.0.2.22             10.0.1.11             TCP      81     4444 > 42792 [PSH, ACK] Seq=1 Ack=79 Win=8960 Len=15 TSval=4061661 TSecr=4062787

Frame 6: 81 bytes on wire (648 bits), 81 bytes captured (648 bits) on interface 0
    Interface id: 0
    Encapsulation type: Ethernet (1)
    Arrival Time: Mar 15, 2016 11:38:53.698310000 CET
    [Time shift for this packet: 0.000000000 seconds]
    Epoch Time: 1458038333.698310000 seconds
    [Time delta from previous captured frame: 0.001805000 seconds]
    [Time delta from previous displayed frame: 0.001805000 seconds]
    [Time since reference or first frame: 0.004213000 seconds]
    Frame Number: 6
    Frame Length: 81 bytes (648 bits)
    Capture Length: 81 bytes (648 bits)
    [Frame is marked: False]
    [Frame is ignored: False]
    [Protocols in frame: eth:ip:tcp:data]
Ethernet II, Src: 68:05:ca:1a:80:18 (68:05:ca:1a:80:18), Dst: 68:05:ca:1a:7c:70 (68:05:ca:1a:7c:70)
    Destination: 68:05:ca:1a:7c:70 (68:05:ca:1a:7c:70)
        Address: 68:05:ca:1a:7c:70 (68:05:ca:1a:7c:70)
        .... ..0. .... .... .... .... = LG bit: Globally unique address (factory default)
        .... ...0 .... .... .... .... = IG bit: Individual address (unicast)
    Source: 68:05:ca:1a:80:18 (68:05:ca:1a:80:18)
        Address: 68:05:ca:1a:80:18 (68:05:ca:1a:80:18)
        .... ..0. .... .... .... .... = LG bit: Globally unique address (factory default)
        .... ...0 .... .... .... .... = IG bit: Individual address (unicast)
    Type: IP (0x0800)
Internet Protocol Version 4, Src: 10.0.2.22 (10.0.2.22), Dst: 10.0.1.11 (10.0.1.11)
    Version: 4
    Header length: 20 bytes
    Differentiated Services Field: 0x00 (DSCP 0x00: Default; ECN: 0x00: Not-ECT (Not ECN-Capable Transport))
        0000 00.. = Differentiated Services Codepoint: Default (0x00)
        .... ..00 = Explicit Congestion Notification: Not-ECT (Not ECN-Capable Transport) (0x00)
    Total Length: 67
    Identification: 0x724e (29262)
    Flags: 0x02 (Don't Fragment)
        0... .... = Reserved bit: Not set
        .1.. .... = Don't fragment: Set
        ..0. .... = More fragments: Not set
    Fragment offset: 0
    Time to live: 63
    Protocol: TCP (6)
    Header checksum: 0xb246 [validation disabled]
        [Good: False]
        [Bad: False]
    Source: 10.0.2.22 (10.0.2.22)
    Destination: 10.0.1.11 (10.0.1.11)
    [Source GeoIP: Unknown]
    [Destination GeoIP: Unknown]
Transmission Control Protocol, Src Port: 4444 (4444), Dst Port: 42792 (42792), Seq: 1, Ack: 79, Len: 15
    Source port: 4444 (4444)
    Destination port: 42792 (42792)
    [Stream index: 0]
    Sequence number: 1    (relative sequence number)
    [Next sequence number: 16    (relative sequence number)]
    Acknowledgment number: 79    (relative ack number)
    Header length: 32 bytes
    Flags: 0x018 (PSH, ACK)
        000. .... .... = Reserved: Not set
        ...0 .... .... = Nonce: Not set
        .... 0... .... = Congestion Window Reduced (CWR): Not set
        .... .0.. .... = ECN-Echo: Not set
        .... ..0. .... = Urgent: Not set
        .... ...1 .... = Acknowledgment: Set
        .... .... 1... = Push: Set
        .... .... .0.. = Reset: Not set
        .... .... ..0. = Syn: Not set
        .... .... ...0 = Fin: Not set
    Window size value: 70
    [Calculated window size: 8960]
    [Window size scaling factor: 128]
    Checksum: 0x43dd [validation disabled]
        [Good Checksum: False]
        [Bad Checksum: False]
    Options: (12 bytes), No-Operation (NOP), No-Operation (NOP), Timestamps
        No-Operation (NOP)
            Type: 1
                0... .... = Copy on fragmentation: No
                .00. .... = Class: Control (0)
                ...0 0001 = Number: No-Operation (NOP) (1)
        No-Operation (NOP)
            Type: 1
                0... .... = Copy on fragmentation: No
                .00. .... = Class: Control (0)
                ...0 0001 = Number: No-Operation (NOP) (1)
        Timestamps: TSval 4061661, TSecr 4062787
            Kind: Timestamp (8)
            Length: 10
            Timestamp value: 4061661
            Timestamp echo reply: 4062787
    [SEQ/ACK analysis]
        [Bytes in flight: 15]
Data (15 bytes)

0000  64 61 74 61 70 6f 72 74 3a 20 35 30 33 38 0a      dataport: 5038.
    Data: 64617461706f72743a20353033380a
    [Length: 15]

No.     Time           Source                Destination           Protocol Length Info
      7 0.004733000    10.0.1.11             10.0.2.22             TCP      66     42792 > 4444 [ACK] Seq=79 Ack=16 Win=29312 Len=0 TSval=4062787 TSecr=4061661

Frame 7: 66 bytes on wire (528 bits), 66 bytes captured (528 bits) on interface 0
    Interface id: 0
    Encapsulation type: Ethernet (1)
    Arrival Time: Mar 15, 2016 11:38:53.698830000 CET
    [Time shift for this packet: 0.000000000 seconds]
    Epoch Time: 1458038333.698830000 seconds
    [Time delta from previous captured frame: 0.000520000 seconds]
    [Time delta from previous displayed frame: 0.000520000 seconds]
    [Time since reference or first frame: 0.004733000 seconds]
    Frame Number: 7
    Frame Length: 66 bytes (528 bits)
    Capture Length: 66 bytes (528 bits)
    [Frame is marked: False]
    [Frame is ignored: False]
    [Protocols in frame: eth:ip:tcp]
Ethernet II, Src: 68:05:ca:1a:7c:70 (68:05:ca:1a:7c:70), Dst: 68:05:ca:1a:80:18 (68:05:ca:1a:80:18)
    Destination: 68:05:ca:1a:80:18 (68:05:ca:1a:80:18)
        Address: 68:05:ca:1a:80:18 (68:05:ca:1a:80:18)
        .... ..0. .... .... .... .... = LG bit: Globally unique address (factory default)
        .... ...0 .... .... .... .... = IG bit: Individual address (unicast)
    Source: 68:05:ca:1a:7c:70 (68:05:ca:1a:7c:70)
        Address: 68:05:ca:1a:7c:70 (68:05:ca:1a:7c:70)
        .... ..0. .... .... .... .... = LG bit: Globally unique address (factory default)
        .... ...0 .... .... .... .... = IG bit: Individual address (unicast)
    Type: IP (0x0800)
Internet Protocol Version 4, Src: 10.0.1.11 (10.0.1.11), Dst: 10.0.2.22 (10.0.2.22)
    Version: 4
    Header length: 20 bytes
    Differentiated Services Field: 0x00 (DSCP 0x00: Default; ECN: 0x00: Not-ECT (Not ECN-Capable Transport))
        0000 00.. = Differentiated Services Codepoint: Default (0x00)
        .... ..00 = Explicit Congestion Notification: Not-ECT (Not ECN-Capable Transport) (0x00)
    Total Length: 52
    Identification: 0x06d5 (1749)
    Flags: 0x02 (Don't Fragment)
        0... .... = Reserved bit: Not set
        .1.. .... = Don't fragment: Set
        ..0. .... = More fragments: Not set
    Fragment offset: 0
    Time to live: 64
    Protocol: TCP (6)
    Header checksum: 0x1ccf [validation disabled]
        [Good: False]
        [Bad: False]
    Source: 10.0.1.11 (10.0.1.11)
    Destination: 10.0.2.22 (10.0.2.22)
    [Source GeoIP: Unknown]
    [Destination GeoIP: Unknown]
Transmission Control Protocol, Src Port: 42792 (42792), Dst Port: 4444 (4444), Seq: 79, Ack: 16, Len: 0
    Source port: 42792 (42792)
    Destination port: 4444 (4444)
    [Stream index: 0]
    Sequence number: 79    (relative sequence number)
    Acknowledgment number: 16    (relative ack number)
    Header length: 32 bytes
    Flags: 0x010 (ACK)
        000. .... .... = Reserved: Not set
        ...0 .... .... = Nonce: Not set
        .... 0... .... = Congestion Window Reduced (CWR): Not set
        .... .0.. .... = ECN-Echo: Not set
        .... ..0. .... = Urgent: Not set
        .... ...1 .... = Acknowledgment: Set
        .... .... 0... = Push: Not set
        .... .... .0.. = Reset: Not set
        .... .... ..0. = Syn: Not set
        .... .... ...0 = Fin: Not set
    Window size value: 229
    [Calculated window size: 29312]
    [Window size scaling factor: 128]
    Checksum: 0xab75 [validation disabled]
        [Good Checksum: False]
        [Bad Checksum: False]
    Options: (12 bytes), No-Operation (NOP), No-Operation (NOP), Timestamps
        No-Operation (NOP)
            Type: 1
                0... .... = Copy on fragmentation: No
                .00. .... = Class: Control (0)
                ...0 0001 = Number: No-Operation (NOP) (1)
        No-Operation (NOP)
            Type: 1
                0... .... = Copy on fragmentation: No
                .00. .... = Class: Control (0)
                ...0 0001 = Number: No-Operation (NOP) (1)
        Timestamps: TSval 4062787, TSecr 4061661
            Kind: Timestamp (8)
            Length: 10
            Timestamp value: 4062787
            Timestamp echo reply: 4061661
    [SEQ/ACK analysis]
        [This is an ACK to the segment in frame: 6]
        [The RTT to ACK the segment was: 0.000520000 seconds]

No.     Time           Source                Destination           Protocol Length Info
      8 0.004984000    10.0.1.11             10.0.2.22             TCP      74     36830 > 5038 [SYN] Seq=0 Win=29200 Len=0 MSS=1460 SACK_PERM=1 TSval=4062787 TSecr=0 WS=128

Frame 8: 74 bytes on wire (592 bits), 74 bytes captured (592 bits) on interface 0
    Interface id: 0
    Encapsulation type: Ethernet (1)
    Arrival Time: Mar 15, 2016 11:38:53.699081000 CET
    [Time shift for this packet: 0.000000000 seconds]
    Epoch Time: 1458038333.699081000 seconds
    [Time delta from previous captured frame: 0.000251000 seconds]
    [Time delta from previous displayed frame: 0.000251000 seconds]
    [Time since reference or first frame: 0.004984000 seconds]
    Frame Number: 8
    Frame Length: 74 bytes (592 bits)
    Capture Length: 74 bytes (592 bits)
    [Frame is marked: False]
    [Frame is ignored: False]
    [Protocols in frame: eth:ip:tcp]
    [Coloring Rule Name: TCP SYN/FIN]
    [Coloring Rule String: tcp.flags & 0x02 || tcp.flags.fin == 1]
Ethernet II, Src: 68:05:ca:1a:7c:70 (68:05:ca:1a:7c:70), Dst: 68:05:ca:1a:80:18 (68:05:ca:1a:80:18)
    Destination: 68:05:ca:1a:80:18 (68:05:ca:1a:80:18)
        Address: 68:05:ca:1a:80:18 (68:05:ca:1a:80:18)
        .... ..0. .... .... .... .... = LG bit: Globally unique address (factory default)
        .... ...0 .... .... .... .... = IG bit: Individual address (unicast)
    Source: 68:05:ca:1a:7c:70 (68:05:ca:1a:7c:70)
        Address: 68:05:ca:1a:7c:70 (68:05:ca:1a:7c:70)
        .... ..0. .... .... .... .... = LG bit: Globally unique address (factory default)
        .... ...0 .... .... .... .... = IG bit: Individual address (unicast)
    Type: IP (0x0800)
Internet Protocol Version 4, Src: 10.0.1.11 (10.0.1.11), Dst: 10.0.2.22 (10.0.2.22)
    Version: 4
    Header length: 20 bytes
    Differentiated Services Field: 0x00 (DSCP 0x00: Default; ECN: 0x00: Not-ECT (Not ECN-Capable Transport))
        0000 00.. = Differentiated Services Codepoint: Default (0x00)
        .... ..00 = Explicit Congestion Notification: Not-ECT (Not ECN-Capable Transport) (0x00)
    Total Length: 60
    Identification: 0xbccf (48335)
    Flags: 0x02 (Don't Fragment)
        0... .... = Reserved bit: Not set
        .1.. .... = Don't fragment: Set
        ..0. .... = More fragments: Not set
    Fragment offset: 0
    Time to live: 64
    Protocol: TCP (6)
    Header checksum: 0x66cc [validation disabled]
        [Good: False]
        [Bad: False]
    Source: 10.0.1.11 (10.0.1.11)
    Destination: 10.0.2.22 (10.0.2.22)
    [Source GeoIP: Unknown]
    [Destination GeoIP: Unknown]
Transmission Control Protocol, Src Port: 36830 (36830), Dst Port: 5038 (5038), Seq: 0, Len: 0
    Source port: 36830 (36830)
    Destination port: 5038 (5038)
    [Stream index: 1]
    Sequence number: 0    (relative sequence number)
    Header length: 40 bytes
    Flags: 0x002 (SYN)
        000. .... .... = Reserved: Not set
        ...0 .... .... = Nonce: Not set
        .... 0... .... = Congestion Window Reduced (CWR): Not set
        .... .0.. .... = ECN-Echo: Not set
        .... ..0. .... = Urgent: Not set
        .... ...0 .... = Acknowledgment: Not set
        .... .... 0... = Push: Not set
        .... .... .0.. = Reset: Not set
        .... .... ..1. = Syn: Set
            [Expert Info (Chat/Sequence): Connection establish request (SYN): server port 5038]
                [Message: Connection establish request (SYN): server port 5038]
                [Severity level: Chat]
                [Group: Sequence]
        .... .... ...0 = Fin: Not set
    Window size value: 29200
    [Calculated window size: 29200]
    Checksum: 0x10d1 [validation disabled]
        [Good Checksum: False]
        [Bad Checksum: False]
    Options: (20 bytes), Maximum segment size, SACK permitted, Timestamps, No-Operation (NOP), Window scale
        Maximum segment size: 1460 bytes
            Kind: MSS size (2)
            Length: 4
            MSS Value: 1460
        TCP SACK Permitted Option: True
            Kind: SACK Permission (4)
            Length: 2
        Timestamps: TSval 4062787, TSecr 0
            Kind: Timestamp (8)
            Length: 10
            Timestamp value: 4062787
            Timestamp echo reply: 0
        No-Operation (NOP)
            Type: 1
                0... .... = Copy on fragmentation: No
                .00. .... = Class: Control (0)
                ...0 0001 = Number: No-Operation (NOP) (1)
        Window scale: 7 (multiply by 128)
            Kind: Window Scale (3)
            Length: 3
            Shift count: 7
            [Multiplier: 128]

No.     Time           Source                Destination           Protocol Length Info
      9 0.005524000    10.0.2.22             10.0.1.11             TCP      74     5038 > 36830 [SYN, ACK] Seq=0 Ack=1 Win=8960 Len=0 MSS=460 SACK_PERM=1 TSval=4061661 TSecr=4062787 WS=128

Frame 9: 74 bytes on wire (592 bits), 74 bytes captured (592 bits) on interface 0
    Interface id: 0
    Encapsulation type: Ethernet (1)
    Arrival Time: Mar 15, 2016 11:38:53.699621000 CET
    [Time shift for this packet: 0.000000000 seconds]
    Epoch Time: 1458038333.699621000 seconds
    [Time delta from previous captured frame: 0.000540000 seconds]
    [Time delta from previous displayed frame: 0.000540000 seconds]
    [Time since reference or first frame: 0.005524000 seconds]
    Frame Number: 9
    Frame Length: 74 bytes (592 bits)
    Capture Length: 74 bytes (592 bits)
    [Frame is marked: False]
    [Frame is ignored: False]
    [Protocols in frame: eth:ip:tcp]
Ethernet II, Src: 68:05:ca:1a:80:18 (68:05:ca:1a:80:18), Dst: 68:05:ca:1a:7c:70 (68:05:ca:1a:7c:70)
    Destination: 68:05:ca:1a:7c:70 (68:05:ca:1a:7c:70)
        Address: 68:05:ca:1a:7c:70 (68:05:ca:1a:7c:70)
        .... ..0. .... .... .... .... = LG bit: Globally unique address (factory default)
        .... ...0 .... .... .... .... = IG bit: Individual address (unicast)
    Source: 68:05:ca:1a:80:18 (68:05:ca:1a:80:18)
        Address: 68:05:ca:1a:80:18 (68:05:ca:1a:80:18)
        .... ..0. .... .... .... .... = LG bit: Globally unique address (factory default)
        .... ...0 .... .... .... .... = IG bit: Individual address (unicast)
    Type: IP (0x0800)
Internet Protocol Version 4, Src: 10.0.2.22 (10.0.2.22), Dst: 10.0.1.11 (10.0.1.11)
    Version: 4
    Header length: 20 bytes
    Differentiated Services Field: 0x00 (DSCP 0x00: Default; ECN: 0x00: Not-ECT (Not ECN-Capable Transport))
        0000 00.. = Differentiated Services Codepoint: Default (0x00)
        .... ..00 = Explicit Congestion Notification: Not-ECT (Not ECN-Capable Transport) (0x00)
    Total Length: 60
    Identification: 0x0000 (0)
    Flags: 0x02 (Don't Fragment)
        0... .... = Reserved bit: Not set
        .1.. .... = Don't fragment: Set
        ..0. .... = More fragments: Not set
    Fragment offset: 0
    Time to live: 63
    Protocol: TCP (6)
    Header checksum: 0x249c [validation disabled]
        [Good: False]
        [Bad: False]
    Source: 10.0.2.22 (10.0.2.22)
    Destination: 10.0.1.11 (10.0.1.11)
    [Source GeoIP: Unknown]
    [Destination GeoIP: Unknown]
Transmission Control Protocol, Src Port: 5038 (5038), Dst Port: 36830 (36830), Seq: 0, Ack: 1, Len: 0
    Source port: 5038 (5038)
    Destination port: 36830 (36830)
    [Stream index: 1]
    Sequence number: 0    (relative sequence number)
    Acknowledgment number: 1    (relative ack number)
    Header length: 40 bytes
    Flags: 0x012 (SYN, ACK)
        000. .... .... = Reserved: Not set
        ...0 .... .... = Nonce: Not set
        .... 0... .... = Congestion Window Reduced (CWR): Not set
        .... .0.. .... = ECN-Echo: Not set
        .... ..0. .... = Urgent: Not set
        .... ...1 .... = Acknowledgment: Set
        .... .... 0... = Push: Not set
        .... .... .0.. = Reset: Not set
        .... .... ..1. = Syn: Set
            [Expert Info (Chat/Sequence): Connection establish acknowledge (SYN+ACK): server port 5038]
                [Message: Connection establish acknowledge (SYN+ACK): server port 5038]
                [Severity level: Chat]
                [Group: Sequence]
        .... .... ...0 = Fin: Not set
    Window size value: 8960
    [Calculated window size: 8960]
    Checksum: 0xd129 [validation disabled]
        [Good Checksum: False]
        [Bad Checksum: False]
