No.     Time           Source                Destination           Protocol Length Info
      9 11.419868000   10.0.1.11             10.0.1.12             TCP      74     48686 > 23 [SYN] Seq=0 Win=29200 Len=0 MSS=1460 SACK_PERM=1 TSval=2946261 TSecr=0 WS=128

Frame 9: 74 bytes on wire (592 bits), 74 bytes captured (592 bits) on interface 0
    Interface id: 0
    Encapsulation type: Ethernet (1)
    Arrival Time: Feb 19, 2016 16:35:32.952167000 CET
    [Time shift for this packet: 0.000000000 seconds]
    Epoch Time: 1455896132.952167000 seconds
    [Time delta from previous captured frame: 6.405703000 seconds]
    [Time delta from previous displayed frame: 0.000000000 seconds]
    [Time since reference or first frame: 11.419868000 seconds]
    Frame Number: 9
    Frame Length: 74 bytes (592 bits)
    Capture Length: 74 bytes (592 bits)
    [Frame is marked: False]
    [Frame is ignored: False]
    [Protocols in frame: eth:ip:tcp]
    [Coloring Rule Name: TCP SYN/FIN]
    [Coloring Rule String: tcp.flags & 0x02 || tcp.flags.fin == 1]
Ethernet II, Src: 68:05:ca:36:33:a0 (68:05:ca:36:33:a0), Dst: 68:05:ca:36:31:f0 (68:05:ca:36:31:f0)
    Destination: 68:05:ca:36:31:f0 (68:05:ca:36:31:f0)
        Address: 68:05:ca:36:31:f0 (68:05:ca:36:31:f0)
        .... ..0. .... .... .... .... = LG bit: Globally unique address (factory default)
        .... ...0 .... .... .... .... = IG bit: Individual address (unicast)
    Source: 68:05:ca:36:33:a0 (68:05:ca:36:33:a0)
        Address: 68:05:ca:36:33:a0 (68:05:ca:36:33:a0)
        .... ..0. .... .... .... .... = LG bit: Globally unique address (factory default)
        .... ...0 .... .... .... .... = IG bit: Individual address (unicast)
    Type: IP (0x0800)
Internet Protocol Version 4, Src: 10.0.1.11 (10.0.1.11), Dst: 10.0.1.12 (10.0.1.12)
    Version: 4
    Header length: 20 bytes
    Differentiated Services Field: 0x10 (DSCP 0x04: Unknown DSCP; ECN: 0x00: Not-ECT (Not ECN-Capable Transport))
        0001 00.. = Differentiated Services Codepoint: Unknown (0x04)
        .... ..00 = Explicit Congestion Notification: Not-ECT (Not ECN-Capable Transport) (0x00)
    Total Length: 60
    Identification: 0x03c6 (966)
    Flags: 0x02 (Don't Fragment)
        0... .... = Reserved bit: Not set
        .1.. .... = Don't fragment: Set
        ..0. .... = More fragments: Not set
    Fragment offset: 0
    Time to live: 64
    Protocol: TCP (6)
    Header checksum: 0x20d0 [validation disabled]
        [Good: False]
        [Bad: False]
    Source: 10.0.1.11 (10.0.1.11)
    Destination: 10.0.1.12 (10.0.1.12)
    [Source GeoIP: Unknown]
    [Destination GeoIP: Unknown]
Transmission Control Protocol, Src Port: 48686 (48686), Dst Port: 23 (23), Seq: 0, Len: 0
    Source port: 48686 (48686)
    Destination port: 23 (23)
    [Stream index: 1]
    Sequence number: 0    (relative sequence number)
    Header length: 40 bytes
    Flags: 0x002 (SYN)
        000. .... .... = Reserved: Not set
        ...0 .... .... = Nonce: Not set
        .... 0... .... = Congestion Window Reduced (CWR): Not set
        .... .0.. .... = ECN-Echo: Not set
        .... ..0. .... = Urgent: Not set
        .... ...0 .... = Acknowledgment: Not set
        .... .... 0... = Push: Not set
        .... .... .0.. = Reset: Not set
        .... .... ..1. = Syn: Set
            [Expert Info (Chat/Sequence): Connection establish request (SYN): server port 23]
                [Message: Connection establish request (SYN): server port 23]
                [Severity level: Chat]
                [Group: Sequence]
        .... .... ...0 = Fin: Not set
    Window size value: 29200
    [Calculated window size: 29200]
    Checksum: 0x1645 [validation disabled]
        [Good Checksum: False]
        [Bad Checksum: False]
    Options: (20 bytes), Maximum segment size, SACK permitted, Timestamps, No-Operation (NOP), Window scale
        Maximum segment size: 1460 bytes
            Kind: MSS size (2)
            Length: 4
            MSS Value: 1460
        TCP SACK Permitted Option: True
            Kind: SACK Permission (4)
            Length: 2
        Timestamps: TSval 2946261, TSecr 0
            Kind: Timestamp (8)
            Length: 10
            Timestamp value: 2946261
            Timestamp echo reply: 0
        No-Operation (NOP)
            Type: 1
                0... .... = Copy on fragmentation: No
                .00. .... = Class: Control (0)
                ...0 0001 = Number: No-Operation (NOP) (1)
        Window scale: 7 (multiply by 128)
            Kind: Window Scale (3)
            Length: 3
            Shift count: 7
            [Multiplier: 128]

No.     Time           Source                Destination           Protocol Length Info
     10 11.420463000   10.0.1.12             10.0.1.11             TCP      74     23 > 48686 [SYN, ACK] Seq=0 Ack=1 Win=28960 Len=0 MSS=1460 SACK_PERM=1 TSval=8518889 TSecr=2946261 WS=128

Frame 10: 74 bytes on wire (592 bits), 74 bytes captured (592 bits) on interface 0
    Interface id: 0
    Encapsulation type: Ethernet (1)
    Arrival Time: Feb 19, 2016 16:35:32.952762000 CET
    [Time shift for this packet: 0.000000000 seconds]
    Epoch Time: 1455896132.952762000 seconds
    [Time delta from previous captured frame: 0.000595000 seconds]
    [Time delta from previous displayed frame: 0.000595000 seconds]
    [Time since reference or first frame: 11.420463000 seconds]
    Frame Number: 10
    Frame Length: 74 bytes (592 bits)
    Capture Length: 74 bytes (592 bits)
    [Frame is marked: False]
    [Frame is ignored: False]
    [Protocols in frame: eth:ip:tcp]
    [Coloring Rule Name: TCP SYN/FIN]
    [Coloring Rule String: tcp.flags & 0x02 || tcp.flags.fin == 1]
Ethernet II, Src: 68:05:ca:36:31:f0 (68:05:ca:36:31:f0), Dst: 68:05:ca:36:33:a0 (68:05:ca:36:33:a0)
    Destination: 68:05:ca:36:33:a0 (68:05:ca:36:33:a0)
        Address: 68:05:ca:36:33:a0 (68:05:ca:36:33:a0)
        .... ..0. .... .... .... .... = LG bit: Globally unique address (factory default)
        .... ...0 .... .... .... .... = IG bit: Individual address (unicast)
    Source: 68:05:ca:36:31:f0 (68:05:ca:36:31:f0)
        Address: 68:05:ca:36:31:f0 (68:05:ca:36:31:f0)
        .... ..0. .... .... .... .... = LG bit: Globally unique address (factory default)
        .... ...0 .... .... .... .... = IG bit: Individual address (unicast)
    Type: IP (0x0800)
Internet Protocol Version 4, Src: 10.0.1.12 (10.0.1.12), Dst: 10.0.1.11 (10.0.1.11)
    Version: 4
    Header length: 20 bytes
    Differentiated Services Field: 0x00 (DSCP 0x00: Default; ECN: 0x00: Not-ECT (Not ECN-Capable Transport))
        0000 00.. = Differentiated Services Codepoint: Default (0x00)
        .... ..00 = Explicit Congestion Notification: Not-ECT (Not ECN-Capable Transport) (0x00)
    Total Length: 60
    Identification: 0x0000 (0)
    Flags: 0x02 (Don't Fragment)
        0... .... = Reserved bit: Not set
        .1.. .... = Don't fragment: Set
        ..0. .... = More fragments: Not set
    Fragment offset: 0
    Time to live: 64
    Protocol: TCP (6)
    Header checksum: 0x24a6 [validation disabled]
        [Good: False]
        [Bad: False]
    Source: 10.0.1.12 (10.0.1.12)
    Destination: 10.0.1.11 (10.0.1.11)
    [Source GeoIP: Unknown]
    [Destination GeoIP: Unknown]
Transmission Control Protocol, Src Port: 23 (23), Dst Port: 48686 (48686), Seq: 0, Ack: 1, Len: 0
    Source port: 23 (23)
    Destination port: 48686 (48686)
    [Stream index: 1]
    Sequence number: 0    (relative sequence number)
    Acknowledgment number: 1    (relative ack number)
    Header length: 40 bytes
    Flags: 0x012 (SYN, ACK)
        000. .... .... = Reserved: Not set
        ...0 .... .... = Nonce: Not set
        .... 0... .... = Congestion Window Reduced (CWR): Not set
        .... .0.. .... = ECN-Echo: Not set
        .... ..0. .... = Urgent: Not set
        .... ...1 .... = Acknowledgment: Set
        .... .... 0... = Push: Not set
        .... .... .0.. = Reset: Not set
        .... .... ..1. = Syn: Set
            [Expert Info (Chat/Sequence): Connection establish acknowledge (SYN+ACK): server port 23]
                [Message: Connection establish acknowledge (SYN+ACK): server port 23]
                [Severity level: Chat]
                [Group: Sequence]
        .... .... ...0 = Fin: Not set
    Window size value: 28960
    [Calculated window size: 28960]
    Checksum: 0x8fe3 [validation disabled]
        [Good Checksum: False]
        [Bad Checksum: False]
    Options: (20 bytes), Maximum segment size, SACK permitted, Timestamps, No-Operation (NOP), Window scale
        Maximum segment size: 1460 bytes
            Kind: MSS size (2)
            Length: 4
            MSS Value: 1460
        TCP SACK Permitted Option: True
            Kind: SACK Permission (4)
            Length: 2
        Timestamps: TSval 8518889, TSecr 2946261
            Kind: Timestamp (8)
            Length: 10
            Timestamp value: 8518889
            Timestamp echo reply: 2946261
        No-Operation (NOP)
            Type: 1
                0... .... = Copy on fragmentation: No
                .00. .... = Class: Control (0)
                ...0 0001 = Number: No-Operation (NOP) (1)
        Window scale: 7 (multiply by 128)
            Kind: Window Scale (3)
            Length: 3
            Shift count: 7
            [Multiplier: 128]
    [SEQ/ACK analysis]
        [This is an ACK to the segment in frame: 9]
        [The RTT to ACK the segment was: 0.000595000 seconds]

No.     Time           Source                Destination           Protocol Length Info
     11 11.420505000   10.0.1.11             10.0.1.12             TCP      66     48686 > 23 [ACK] Seq=1 Ack=1 Win=29312 Len=0 TSval=2946261 TSecr=8518889

Frame 11: 66 bytes on wire (528 bits), 66 bytes captured (528 bits) on interface 0
    Interface id: 0
    Encapsulation type: Ethernet (1)
    Arrival Time: Feb 19, 2016 16:35:32.952804000 CET
    [Time shift for this packet: 0.000000000 seconds]
    Epoch Time: 1455896132.952804000 seconds
    [Time delta from previous captured frame: 0.000042000 seconds]
    [Time delta from previous displayed frame: 0.000042000 seconds]
    [Time since reference or first frame: 11.420505000 seconds]
    Frame Number: 11
    Frame Length: 66 bytes (528 bits)
    Capture Length: 66 bytes (528 bits)
    [Frame is marked: False]
    [Frame is ignored: False]
    [Protocols in frame: eth:ip:tcp]
    [Coloring Rule Name: TCP]
    [Coloring Rule String: tcp]
Ethernet II, Src: 68:05:ca:36:33:a0 (68:05:ca:36:33:a0), Dst: 68:05:ca:36:31:f0 (68:05:ca:36:31:f0)
    Destination: 68:05:ca:36:31:f0 (68:05:ca:36:31:f0)
        Address: 68:05:ca:36:31:f0 (68:05:ca:36:31:f0)
        .... ..0. .... .... .... .... = LG bit: Globally unique address (factory default)
        .... ...0 .... .... .... .... = IG bit: Individual address (unicast)
    Source: 68:05:ca:36:33:a0 (68:05:ca:36:33:a0)
        Address: 68:05:ca:36:33:a0 (68:05:ca:36:33:a0)
        .... ..0. .... .... .... .... = LG bit: Globally unique address (factory default)
        .... ...0 .... .... .... .... = IG bit: Individual address (unicast)
    Type: IP (0x0800)
Internet Protocol Version 4, Src: 10.0.1.11 (10.0.1.11), Dst: 10.0.1.12 (10.0.1.12)
    Version: 4
    Header length: 20 bytes
    Differentiated Services Field: 0x10 (DSCP 0x04: Unknown DSCP; ECN: 0x00: Not-ECT (Not ECN-Capable Transport))
        0001 00.. = Differentiated Services Codepoint: Unknown (0x04)
        .... ..00 = Explicit Congestion Notification: Not-ECT (Not ECN-Capable Transport) (0x00)
    Total Length: 52
    Identification: 0x03c7 (967)
    Flags: 0x02 (Don't Fragment)
        0... .... = Reserved bit: Not set
        .1.. .... = Don't fragment: Set
        ..0. .... = More fragments: Not set
    Fragment offset: 0
    Time to live: 64
    Protocol: TCP (6)
    Header checksum: 0x20d7 [validation disabled]
        [Good: False]
        [Bad: False]
    Source: 10.0.1.11 (10.0.1.11)
    Destination: 10.0.1.12 (10.0.1.12)
    [Source GeoIP: Unknown]
    [Destination GeoIP: Unknown]
Transmission Control Protocol, Src Port: 48686 (48686), Dst Port: 23 (23), Seq: 1, Ack: 1, Len: 0
    Source port: 48686 (48686)
    Destination port: 23 (23)
    [Stream index: 1]
    Sequence number: 1    (relative sequence number)
    Acknowledgment number: 1    (relative ack number)
    Header length: 32 bytes
    Flags: 0x010 (ACK)
        000. .... .... = Reserved: Not set
        ...0 .... .... = Nonce: Not set
        .... 0... .... = Congestion Window Reduced (CWR): Not set
        .... .0.. .... = ECN-Echo: Not set
        .... ..0. .... = Urgent: Not set
        .... ...1 .... = Acknowledgment: Set
        .... .... 0... = Push: Not set
        .... .... .0.. = Reset: Not set
        .... .... ..0. = Syn: Not set
        .... .... ...0 = Fin: Not set
    Window size value: 229
    [Calculated window size: 29312]
    [Window size scaling factor: 128]
    Checksum: 0x163d [validation disabled]
        [Good Checksum: False]
        [Bad Checksum: False]
    Options: (12 bytes), No-Operation (NOP), No-Operation (NOP), Timestamps
        No-Operation (NOP)
            Type: 1
                0... .... = Copy on fragmentation: No
                .00. .... = Class: Control (0)
                ...0 0001 = Number: No-Operation (NOP) (1)
        No-Operation (NOP)
            Type: 1
                0... .... = Copy on fragmentation: No
                .00. .... = Class: Control (0)
                ...0 0001 = Number: No-Operation (NOP) (1)
        Timestamps: TSval 2946261, TSecr 8518889
            Kind: Timestamp (8)
            Length: 10
            Timestamp value: 2946261
            Timestamp echo reply: 8518889
    [SEQ/ACK analysis]
        [This is an ACK to the segment in frame: 10]
        [The RTT to ACK the segment was: 0.000042000 seconds]

No.     Time           Source                Destination           Protocol Length Info
     12 11.420634000   10.0.1.11             10.0.1.12             TELNET   93     Telnet Data ...

Frame 12: 93 bytes on wire (744 bits), 93 bytes captured (744 bits) on interface 0
    Interface id: 0
    Encapsulation type: Ethernet (1)
    Arrival Time: Feb 19, 2016 16:35:32.952933000 CET
    [Time shift for this packet: 0.000000000 seconds]
    Epoch Time: 1455896132.952933000 seconds
    [Time delta from previous captured frame: 0.000129000 seconds]
    [Time delta from previous displayed frame: 0.000129000 seconds]
    [Time since reference or first frame: 11.420634000 seconds]
    Frame Number: 12
    Frame Length: 93 bytes (744 bits)
    Capture Length: 93 bytes (744 bits)
    [Frame is marked: False]
    [Frame is ignored: False]
    [Protocols in frame: eth:ip:tcp:telnet]
    [Coloring Rule Name: TCP]
    [Coloring Rule String: tcp]
Ethernet II, Src: 68:05:ca:36:33:a0 (68:05:ca:36:33:a0), Dst: 68:05:ca:36:31:f0 (68:05:ca:36:31:f0)
    Destination: 68:05:ca:36:31:f0 (68:05:ca:36:31:f0)
        Address: 68:05:ca:36:31:f0 (68:05:ca:36:31:f0)
        .... ..0. .... .... .... .... = LG bit: Globally unique address (factory default)
        .... ...0 .... .... .... .... = IG bit: Individual address (unicast)
    Source: 68:05:ca:36:33:a0 (68:05:ca:36:33:a0)
        Address: 68:05:ca:36:33:a0 (68:05:ca:36:33:a0)
        .... ..0. .... .... .... .... = LG bit: Globally unique address (factory default)
        .... ...0 .... .... .... .... = IG bit: Individual address (unicast)
    Type: IP (0x0800)
Internet Protocol Version 4, Src: 10.0.1.11 (10.0.1.11), Dst: 10.0.1.12 (10.0.1.12)
    Version: 4
    Header length: 20 bytes
    Differentiated Services Field: 0x10 (DSCP 0x04: Unknown DSCP; ECN: 0x00: Not-ECT (Not ECN-Capable Transport))
        0001 00.. = Differentiated Services Codepoint: Unknown (0x04)
        .... ..00 = Explicit Congestion Notification: Not-ECT (Not ECN-Capable Transport) (0x00)
    Total Length: 79
    Identification: 0x03c8 (968)
    Flags: 0x02 (Don't Fragment)
        0... .... = Reserved bit: Not set
        .1.. .... = Don't fragment: Set
        ..0. .... = More fragments: Not set
    Fragment offset: 0
    Time to live: 64
    Protocol: TCP (6)
    Header checksum: 0x20bb [validation disabled]
        [Good: False]
        [Bad: False]
    Source: 10.0.1.11 (10.0.1.11)
    Destination: 10.0.1.12 (10.0.1.12)
    [Source GeoIP: Unknown]
    [Destination GeoIP: Unknown]
Transmission Control Protocol, Src Port: 48686 (48686), Dst Port: 23 (23), Seq: 1, Ack: 1, Len: 27
    Source port: 48686 (48686)
    Destination port: 23 (23)
    [Stream index: 1]
    Sequence number: 1    (relative sequence number)
    [Next sequence number: 28    (relative sequence number)]
    Acknowledgment number: 1    (relative ack number)
    Header length: 32 bytes
    Flags: 0x018 (PSH, ACK)
        000. .... .... = Reserved: Not set
        ...0 .... .... = Nonce: Not set
        .... 0... .... = Congestion Window Reduced (CWR): Not set
        .... .0.. .... = ECN-Echo: Not set
        .... ..0. .... = Urgent: Not set
        .... ...1 .... = Acknowledgment: Set
        .... .... 1... = Push: Set
        .... .... .0.. = Reset: Not set
        .... .... ..0. = Syn: Not set
        .... .... ...0 = Fin: Not set
    Window size value: 229
    [Calculated window size: 29312]
    [Window size scaling factor: 128]
    Checksum: 0x1658 [validation disabled]
        [Good Checksum: False]
        [Bad Checksum: False]
    Options: (12 bytes), No-Operation (NOP), No-Operation (NOP), Timestamps
        No-Operation (NOP)
            Type: 1
                0... .... = Copy on fragmentation: No
                .00. .... = Class: Control (0)
                ...0 0001 = Number: No-Operation (NOP) (1)
        No-Operation (NOP)
            Type: 1
                0... .... = Copy on fragmentation: No
                .00. .... = Class: Control (0)
                ...0 0001 = Number: No-Operation (NOP) (1)
        Timestamps: TSval 2946261, TSecr 8518889
            Kind: Timestamp (8)
            Length: 10
            Timestamp value: 2946261
            Timestamp echo reply: 8518889
    [SEQ/ACK analysis]
        [Bytes in flight: 27]
Telnet
    Do Suppress Go Ahead
        Command: Do (253)
        Subcommand: Suppress Go Ahead
    Will Terminal Type
        Command: Will (251)
        Subcommand: Terminal Type
    Will Negotiate About Window Size
        Command: Will (251)
        Subcommand: Negotiate About Window Size
    Will Terminal Speed
        Command: Will (251)
        Subcommand: Terminal Speed
    Will Remote Flow Control
        Command: Will (251)
        Subcommand: Remote Flow Control
    Will Linemode
        Command: Will (251)
        Subcommand: Linemode
    Will New Environment Option
        Command: Will (251)
        Subcommand: New Environment Option
    Do Status
        Command: Do (253)
        Subcommand: Status
    Will X Display Location
        Command: Will (251)
        Subcommand: X Display Location

No.     Time           Source                Destination           Protocol Length Info
     13 11.421143000   10.0.1.12             10.0.1.11             TCP      66     23 > 48686 [ACK] Seq=1 Ack=28 Win=29056 Len=0 TSval=8518889 TSecr=2946261

Frame 13: 66 bytes on wire (528 bits), 66 bytes captured (528 bits) on interface 0
    Interface id: 0
    Encapsulation type: Ethernet (1)
    Arrival Time: Feb 19, 2016 16:35:32.953442000 CET
    [Time shift for this packet: 0.000000000 seconds]
    Epoch Time: 1455896132.953442000 seconds
    [Time delta from previous captured frame: 0.000509000 seconds]
    [Time delta from previous displayed frame: 0.000509000 seconds]
    [Time since reference or first frame: 11.421143000 seconds]
    Frame Number: 13
    Frame Length: 66 bytes (528 bits)
    Capture Length: 66 bytes (528 bits)
    [Frame is marked: False]
    [Frame is ignored: False]
    [Protocols in frame: eth:ip:tcp]
    [Coloring Rule Name: TCP]
    [Coloring Rule String: tcp]
Ethernet II, Src: 68:05:ca:36:31:f0 (68:05:ca:36:31:f0), Dst: 68:05:ca:36:33:a0 (68:05:ca:36:33:a0)
    Destination: 68:05:ca:36:33:a0 (68:05:ca:36:33:a0)
        Address: 68:05:ca:36:33:a0 (68:05:ca:36:33:a0)
        .... ..0. .... .... .... .... = LG bit: Globally unique address (factory default)
        .... ...0 .... .... .... .... = IG bit: Individual address (unicast)
    Source: 68:05:ca:36:31:f0 (68:05:ca:36:31:f0)
        Address: 68:05:ca:36:31:f0 (68:05:ca:36:31:f0)
        .... ..0. .... .... .... .... = LG bit: Globally unique address (factory default)
        .... ...0 .... .... .... .... = IG bit: Individual address (unicast)
    Type: IP (0x0800)
Internet Protocol Version 4, Src: 10.0.1.12 (10.0.1.12), Dst: 10.0.1.11 (10.0.1.11)
    Version: 4
    Header length: 20 bytes
    Differentiated Services Field: 0x00 (DSCP 0x00: Default; ECN: 0x00: Not-ECT (Not ECN-Capable Transport))
        0000 00.. = Differentiated Services Codepoint: Default (0x00)
        .... ..00 = Explicit Congestion Notification: Not-ECT (Not ECN-Capable Transport) (0x00)
    Total Length: 52
    Identification: 0x6cd0 (27856)
    Flags: 0x02 (Don't Fragment)
        0... .... = Reserved bit: Not set
        .1.. .... = Don't fragment: Set
        ..0. .... = More fragments: Not set
    Fragment offset: 0
    Time to live: 64
    Protocol: TCP (6)
    Header checksum: 0xb7dd [validation disabled]
        [Good: False]
        [Bad: False]
    Source: 10.0.1.12 (10.0.1.12)
    Destination: 10.0.1.11 (10.0.1.11)
    [Source GeoIP: Unknown]
    [Destination GeoIP: Unknown]
Transmission Control Protocol, Src Port: 23 (23), Dst Port: 48686 (48686), Seq: 1, Ack: 28, Len: 0
    Source port: 23 (23)
    Destination port: 48686 (48686)
    [Stream index: 1]
    Sequence number: 1    (relative sequence number)
    Acknowledgment number: 28    (relative ack number)
    Header length: 32 bytes
    Flags: 0x010 (ACK)
        000. .... .... = Reserved: Not set
        ...0 .... .... = Nonce: Not set
        .... 0... .... = Congestion Window Reduced (CWR): Not set
        .... .0.. .... = ECN-Echo: Not set
        .... ..0. .... = Urgent: Not set
        .... ...1 .... = Acknowledgment: Set
        .... .... 0... = Push: Not set
        .... .... .0.. = Reset: Not set
        .... .... ..0. = Syn: Not set
        .... .... ...0 = Fin: Not set
    Window size value: 227
    [Calculated window size: 29056]
    [Window size scaling factor: 128]
    Checksum: 0x2ed2 [validation disabled]
        [Good Checksum: False]
        [Bad Checksum: False]
    Options: (12 bytes), No-Operation (NOP), No-Operation (NOP), Timestamps
        No-Operation (NOP)
            Type: 1
                0... .... = Copy on fragmentation: No
                .00. .... = Class: Control (0)
                ...0 0001 = Number: No-Operation (NOP) (1)
        No-Operation (NOP)
            Type: 1
                0... .... = Copy on fragmentation: No
                .00. .... = Class: Control (0)
                ...0 0001 = Number: No-Operation (NOP) (1)
        Timestamps: TSval 8518889, TSecr 2946261
            Kind: Timestamp (8)
            Length: 10
            Timestamp value: 8518889
            Timestamp echo reply: 2946261
    [SEQ/ACK analysis]
        [This is an ACK to the segment in frame: 12]
        [The RTT to ACK the segment was: 0.000509000 seconds]

No.     Time           Source                Destination           Protocol Length Info
     16 21.436250000   10.0.1.12             10.0.1.11             TELNET   87     Telnet Data ...

Frame 16: 87 bytes on wire (696 bits), 87 bytes captured (696 bits) on interface 0
    Interface id: 0
    Encapsulation type: Ethernet (1)
    Arrival Time: Feb 19, 2016 16:35:42.968549000 CET
    [Time shift for this packet: 0.000000000 seconds]
    Epoch Time: 1455896142.968549000 seconds
    [Time delta from previous captured frame: 5.013545000 seconds]
    [Time delta from previous displayed frame: 10.015107000 seconds]
    [Time since reference or first frame: 21.436250000 seconds]
    Frame Number: 16
    Frame Length: 87 bytes (696 bits)
    Capture Length: 87 bytes (696 bits)
    [Frame is marked: False]
    [Frame is ignored: False]
    [Protocols in frame: eth:ip:tcp:telnet]
    [Coloring Rule Name: TCP]
    [Coloring Rule String: tcp]
Ethernet II, Src: 68:05:ca:36:31:f0 (68:05:ca:36:31:f0), Dst: 68:05:ca:36:33:a0 (68:05:ca:36:33:a0)
    Destination: 68:05:ca:36:33:a0 (68:05:ca:36:33:a0)
        Address: 68:05:ca:36:33:a0 (68:05:ca:36:33:a0)
        .... ..0. .... .... .... .... = LG bit: Globally unique address (factory default)
        .... ...0 .... .... .... .... = IG bit: Individual address (unicast)
    Source: 68:05:ca:36:31:f0 (68:05:ca:36:31:f0)
        Address: 68:05:ca:36:31:f0 (68:05:ca:36:31:f0)
        .... ..0. .... .... .... .... = LG bit: Globally unique address (factory default)
        .... ...0 .... .... .... .... = IG bit: Individual address (unicast)
    Type: IP (0x0800)
Internet Protocol Version 4, Src: 10.0.1.12 (10.0.1.12), Dst: 10.0.1.11 (10.0.1.11)
    Version: 4
    Header length: 20 bytes
    Differentiated Services Field: 0x00 (DSCP 0x00: Default; ECN: 0x00: Not-ECT (Not ECN-Capable Transport))
        0000 00.. = Differentiated Services Codepoint: Default (0x00)
        .... ..00 = Explicit Congestion Notification: Not-ECT (Not ECN-Capable Transport) (0x00)
    Total Length: 73
    Identification: 0x6cd1 (27857)
    Flags: 0x02 (Don't Fragment)
        0... .... = Reserved bit: Not set
        .1.. .... = Don't fragment: Set
        ..0. .... = More fragments: Not set
    Fragment offset: 0
    Time to live: 64
    Protocol: TCP (6)
    Header checksum: 0xb7c7 [validation disabled]
        [Good: False]
        [Bad: False]
    Source: 10.0.1.12 (10.0.1.12)
    Destination: 10.0.1.11 (10.0.1.11)
    [Source GeoIP: Unknown]
    [Destination GeoIP: Unknown]
Transmission Control Protocol, Src Port: 23 (23), Dst Port: 48686 (48686), Seq: 1, Ack: 28, Len: 21
    Source port: 23 (23)
    Destination port: 48686 (48686)
    [Stream index: 1]
    Sequence number: 1    (relative sequence number)
    [Next sequence number: 22    (relative sequence number)]
    Acknowledgment number: 28    (relative ack number)
    Header length: 32 bytes
    Flags: 0x018 (PSH, ACK)
        000. .... .... = Reserved: Not set
        ...0 .... .... = Nonce: Not set
        .... 0... .... = Congestion Window Reduced (CWR): Not set
        .... .0.. .... = ECN-Echo: Not set
        .... ..0. .... = Urgent: Not set
        .... ...1 .... = Acknowledgment: Set
        .... .... 1... = Push: Set
        .... .... .0.. = Reset: Not set
        .... .... ..0. = Syn: Not set
        .... .... ...0 = Fin: Not set
    Window size value: 227
    [Calculated window size: 29056]
    [Window size scaling factor: 128]
    Checksum: 0xa889 [validation disabled]
        [Good Checksum: False]
        [Bad Checksum: False]
    Options: (12 bytes), No-Operation (NOP), No-Operation (NOP), Timestamps
        No-Operation (NOP)
            Type: 1
                0... .... = Copy on fragmentation: No
                .00. .... = Class: Control (0)
                ...0 0001 = Number: No-Operation (NOP) (1)
        No-Operation (NOP)
            Type: 1
                0... .... = Copy on fragmentation: No
                .00. .... = Class: Control (0)
                ...0 0001 = Number: No-Operation (NOP) (1)
        Timestamps: TSval 8521393, TSecr 2946261
            Kind: Timestamp (8)
            Length: 10
            Timestamp value: 8521393
            Timestamp echo reply: 2946261
    [SEQ/ACK analysis]
        [Bytes in flight: 21]
Telnet
    Will Authentication Option
        Command: Will (251)
        Subcommand: Authentication Option
    Will Encryption Option
        Command: Will (251)
        Subcommand: Encryption Option
    Do Terminal Type
        Command: Do (253)
        Subcommand: Terminal Type
    Do Terminal Speed
        Command: Do (253)
        Subcommand: Terminal Speed
    Do X Display Location
        Command: Do (253)
        Subcommand: X Display Location
    Do New Environment Option
        Command: Do (253)
        Subcommand: New Environment Option
    Do Environment Option
        Command: Do (253)
        Subcommand: Environment Option

No.     Time           Source                Destination           Protocol Length Info
     17 21.436284000   10.0.1.11             10.0.1.12             TCP      66     48686 > 23 [ACK] Seq=28 Ack=22 Win=29312 Len=0 TSval=2948765 TSecr=8521393

Frame 17: 66 bytes on wire (528 bits), 66 bytes captured (528 bits) on interface 0
    Interface id: 0
    Encapsulation type: Ethernet (1)
    Arrival Time: Feb 19, 2016 16:35:42.968583000 CET
    [Time shift for this packet: 0.000000000 seconds]
    Epoch Time: 1455896142.968583000 seconds
    [Time delta from previous captured frame: 0.000034000 seconds]
    [Time delta from previous displayed frame: 0.000034000 seconds]
    [Time since reference or first frame: 21.436284000 seconds]
    Frame Number: 17
    Frame Length: 66 bytes (528 bits)
    Capture Length: 66 bytes (528 bits)
    [Frame is marked: False]
    [Frame is ignored: False]
    [Protocols in frame: eth:ip:tcp]
    [Coloring Rule Name: TCP]
    [Coloring Rule String: tcp]
Ethernet II, Src: 68:05:ca:36:33:a0 (68:05:ca:36:33:a0), Dst: 68:05:ca:36:31:f0 (68:05:ca:36:31:f0)
    Destination: 68:05:ca:36:31:f0 (68:05:ca:36:31:f0)
        Address: 68:05:ca:36:31:f0 (68:05:ca:36:31:f0)
        .... ..0. .... .... .... .... = LG bit: Globally unique address (factory default)
        .... ...0 .... .... .... .... = IG bit: Individual address (unicast)
    Source: 68:05:ca:36:33:a0 (68:05:ca:36:33:a0)
        Address: 68:05:ca:36:33:a0 (68:05:ca:36:33:a0)
        .... ..0. .... .... .... .... = LG bit: Globally unique address (factory default)
        .... ...0 .... .... .... .... = IG bit: Individual address (unicast)
    Type: IP (0x0800)
Internet Protocol Version 4, Src: 10.0.1.11 (10.0.1.11), Dst: 10.0.1.12 (10.0.1.12)
    Version: 4
    Header length: 20 bytes
    Differentiated Services Field: 0x10 (DSCP 0x04: Unknown DSCP; ECN: 0x00: Not-ECT (Not ECN-Capable Transport))
        0001 00.. = Differentiated Services Codepoint: Unknown (0x04)
        .... ..00 = Explicit Congestion Notification: Not-ECT (Not ECN-Capable Transport) (0x00)
    Total Length: 52
    Identification: 0x03c9 (969)
    Flags: 0x02 (Don't Fragment)
        0... .... = Reserved bit: Not set
        .1.. .... = Don't fragment: Set
        ..0. .... = More fragments: Not set
    Fragment offset: 0
    Time to live: 64
    Protocol: TCP (6)
    Header checksum: 0x20d5 [validation disabled]
        [Good: False]
        [Bad: False]
    Source: 10.0.1.11 (10.0.1.11)
    Destination: 10.0.1.12 (10.0.1.12)
    [Source GeoIP: Unknown]
    [Destination GeoIP: Unknown]
Transmission Control Protocol, Src Port: 48686 (48686), Dst Port: 23 (23), Seq: 28, Ack: 22, Len: 0
    Source port: 48686 (48686)
    Destination port: 23 (23)
    [Stream index: 1]
    Sequence number: 28    (relative sequence number)
    Acknowledgment number: 22    (relative ack number)
    Header length: 32 bytes
    Flags: 0x010 (ACK)
        000. .... .... = Reserved: Not set
        ...0 .... .... = Nonce: Not set
        .... 0... .... = Congestion Window Reduced (CWR): Not set
        .... .0.. .... = ECN-Echo: Not set
        .... ..0. .... = Urgent: Not set
        .... ...1 .... = Acknowledgment: Set
        .... .... 0... = Push: Not set
        .... .... .0.. = Reset: Not set
        .... .... ..0. = Syn: Not set
        .... .... ...0 = Fin: Not set
    Window size value: 229
    [Calculated window size: 29312]
    [Window size scaling factor: 128]
    Checksum: 0x163d [validation disabled]
        [Good Checksum: False]
        [Bad Checksum: False]
    Options: (12 bytes), No-Operation (NOP), No-Operation (NOP), Timestamps
        No-Operation (NOP)
            Type: 1
                0... .... = Copy on fragmentation: No
                .00. .... = Class: Control (0)
                ...0 0001 = Number: No-Operation (NOP) (1)
        No-Operation (NOP)
            Type: 1
                0... .... = Copy on fragmentation: No
                .00. .... = Class: Control (0)
                ...0 0001 = Number: No-Operation (NOP) (1)
        Timestamps: TSval 2948765, TSecr 8521393
            Kind: Timestamp (8)
            Length: 10
            Timestamp value: 2948765
            Timestamp echo reply: 8521393
    [SEQ/ACK analysis]
        [This is an ACK to the segment in frame: 16]
        [The RTT to ACK the segment was: 0.000034000 seconds]

No.     Time           Source                Destination           Protocol Length Info
     18 21.436340000   10.0.1.11             10.0.1.12             TELNET   75     Telnet Data ...

Frame 18: 75 bytes on wire (600 bits), 75 bytes captured (600 bits) on interface 0
    Interface id: 0
    Encapsulation type: Ethernet (1)
    Arrival Time: Feb 19, 2016 16:35:42.968639000 CET
    [Time shift for this packet: 0.000000000 seconds]
    Epoch Time: 1455896142.968639000 seconds
    [Time delta from previous captured frame: 0.000056000 seconds]
    [Time delta from previous displayed frame: 0.000056000 seconds]
    [Time since reference or first frame: 21.436340000 seconds]
    Frame Number: 18
    Frame Length: 75 bytes (600 bits)
    Capture Length: 75 bytes (600 bits)
    [Frame is marked: False]
    [Frame is ignored: False]
    [Protocols in frame: eth:ip:tcp:telnet]
    [Coloring Rule Name: TCP]
    [Coloring Rule String: tcp]
Ethernet II, Src: 68:05:ca:36:33:a0 (68:05:ca:36:33:a0), Dst: 68:05:ca:36:31:f0 (68:05:ca:36:31:f0)
    Destination: 68:05:ca:36:31:f0 (68:05:ca:36:31:f0)
        Address: 68:05:ca:36:31:f0 (68:05:ca:36:31:f0)
        .... ..0. .... .... .... .... = LG bit: Globally unique address (factory default)
        .... ...0 .... .... .... .... = IG bit: Individual address (unicast)
    Source: 68:05:ca:36:33:a0 (68:05:ca:36:33:a0)
        Address: 68:05:ca:36:33:a0 (68:05:ca:36:33:a0)
        .... ..0. .... .... .... .... = LG bit: Globally unique address (factory default)
        .... ...0 .... .... .... .... = IG bit: Individual address (unicast)
    Type: IP (0x0800)
Internet Protocol Version 4, Src: 10.0.1.11 (10.0.1.11), Dst: 10.0.1.12 (10.0.1.12)
    Version: 4
    Header length: 20 bytes
    Differentiated Services Field: 0x10 (DSCP 0x04: Unknown DSCP; ECN: 0x00: Not-ECT (Not ECN-Capable Transport))
        0001 00.. = Differentiated Services Codepoint: Unknown (0x04)
        .... ..00 = Explicit Congestion Notification: Not-ECT (Not ECN-Capable Transport) (0x00)
    Total Length: 61
    Identification: 0x03ca (970)
    Flags: 0x02 (Don't Fragment)
        0... .... = Reserved bit: Not set
        .1.. .... = Don't fragment: Set
        ..0. .... = More fragments: Not set
    Fragment offset: 0
    Time to live: 64
    Protocol: TCP (6)
    Header checksum: 0x20cb [validation disabled]
        [Good: False]
        [Bad: False]
    Source: 10.0.1.11 (10.0.1.11)
    Destination: 10.0.1.12 (10.0.1.12)
    [Source GeoIP: Unknown]
    [Destination GeoIP: Unknown]
Transmission Control Protocol, Src Port: 48686 (48686), Dst Port: 23 (23), Seq: 28, Ack: 22, Len: 9
    Source port: 48686 (48686)
    Destination port: 23 (23)
    [Stream index: 1]
    Sequence number: 28    (relative sequence number)
    [Next sequence number: 37    (relative sequence number)]
    Acknowledgment number: 22    (relative ack number)
    Header length: 32 bytes
    Flags: 0x018 (PSH, ACK)
        000. .... .... = Reserved: Not set
        ...0 .... .... = Nonce: Not set
        .... 0... .... = Congestion Window Reduced (CWR): Not set
        .... .0.. .... = ECN-Echo: Not set
        .... ..0. .... = Urgent: Not set
        .... ...1 .... = Acknowledgment: Set
        .... .... 1... = Push: Set
        .... .... .0.. = Reset: Not set
        .... .... ..0. = Syn: Not set
        .... .... ...0 = Fin: Not set
    Window size value: 229
    [Calculated window size: 29312]
    [Window size scaling factor: 128]
    Checksum: 0x1646 [validation disabled]
        [Good Checksum: False]
        [Bad Checksum: False]
    Options: (12 bytes), No-Operation (NOP), No-Operation (NOP), Timestamps
        No-Operation (NOP)
            Type: 1
                0... .... = Copy on fragmentation: No
                .00. .... = Class: Control (0)
                ...0 0001 = Number: No-Operation (NOP) (1)
        No-Operation (NOP)
            Type: 1
                0... .... = Copy on fragmentation: No
                .00. .... = Class: Control (0)
                ...0 0001 = Number: No-Operation (NOP) (1)
        Timestamps: TSval 2948765, TSecr 8521393
            Kind: Timestamp (8)
            Length: 10
            Timestamp value: 2948765
            Timestamp echo reply: 8521393
    [SEQ/ACK analysis]
        [Bytes in flight: 9]
Telnet
    Don't Authentication Option
        Command: Don't (254)
        Subcommand: Authentication Option
    Don't Encryption Option
        Command: Don't (254)
        Subcommand: Encryption Option
    Won't Environment Option
        Command: Won't (252)
        Subcommand: Environment Option

No.     Time           Source                Destination           Protocol Length Info
     19 21.436738000   10.0.1.12             10.0.1.11             TELNET   88     Telnet Data ...

Frame 19: 88 bytes on wire (704 bits), 88 bytes captured (704 bits) on interface 0
    Interface id: 0
    Encapsulation type: Ethernet (1)
    Arrival Time: Feb 19, 2016 16:35:42.969037000 CET
    [Time shift for this packet: 0.000000000 seconds]
    Epoch Time: 1455896142.969037000 seconds
    [Time delta from previous captured frame: 0.000398000 seconds]
    [Time delta from previous displayed frame: 0.000398000 seconds]
    [Time since reference or first frame: 21.436738000 seconds]
    Frame Number: 19
    Frame Length: 88 bytes (704 bits)
    Capture Length: 88 bytes (704 bits)
    [Frame is marked: False]
    [Frame is ignored: False]
    [Protocols in frame: eth:ip:tcp:telnet]
    [Coloring Rule Name: TCP]
    [Coloring Rule String: tcp]
Ethernet II, Src: 68:05:ca:36:31:f0 (68:05:ca:36:31:f0), Dst: 68:05:ca:36:33:a0 (68:05:ca:36:33:a0)
    Destination: 68:05:ca:36:33:a0 (68:05:ca:36:33:a0)
        Address: 68:05:ca:36:33:a0 (68:05:ca:36:33:a0)
        .... ..0. .... .... .... .... = LG bit: Globally unique address (factory default)
        .... ...0 .... .... .... .... = IG bit: Individual address (unicast)
    Source: 68:05:ca:36:31:f0 (68:05:ca:36:31:f0)
        Address: 68:05:ca:36:31:f0 (68:05:ca:36:31:f0)
        .... ..0. .... .... .... .... = LG bit: Globally unique address (factory default)
        .... ...0 .... .... .... .... = IG bit: Individual address (unicast)
    Type: IP (0x0800)
Internet Protocol Version 4, Src: 10.0.1.12 (10.0.1.12), Dst: 10.0.1.11 (10.0.1.11)
    Version: 4
    Header length: 20 bytes
    Differentiated Services Field: 0x00 (DSCP 0x00: Default; ECN: 0x00: Not-ECT (Not ECN-Capable Transport))
        0000 00.. = Differentiated Services Codepoint: Default (0x00)
        .... ..00 = Explicit Congestion Notification: Not-ECT (Not ECN-Capable Transport) (0x00)
    Total Length: 74
    Identification: 0x6cd2 (27858)
    Flags: 0x02 (Don't Fragment)
        0... .... = Reserved bit: Not set
        .1.. .... = Don't fragment: Set
        ..0. .... = More fragments: Not set
    Fragment offset: 0
    Time to live: 64
    Protocol: TCP (6)
    Header checksum: 0xb7c5 [validation disabled]
        [Good: False]
        [Bad: False]
    Source: 10.0.1.12 (10.0.1.12)
    Destination: 10.0.1.11 (10.0.1.11)
    [Source GeoIP: Unknown]
    [Destination GeoIP: Unknown]
Transmission Control Protocol, Src Port: 23 (23), Dst Port: 48686 (48686), Seq: 22, Ack: 28, Len: 22
    Source port: 23 (23)
    Destination port: 48686 (48686)
    [Stream index: 1]
